id,word,word_definition,antonyms,synonyms,example,relevance
659,Apple,A fruit with red or green skin and a white inside,None,"Fruit, Pomme, Orchard apple",I love to eat apples for my snack.,1 class
660,Ball,A round object used for games and sports,"Flat, Square","Sphere, Globe, Orb",Let's go outside and play ball.,1 class
661,Cat,"A small, furry, carnivorous animal with whiskers and retractable claws","Dog, Mouse","Feline, Kitty, Tomcat",My cat loves to play with balls of yarn.,1 class
662,Dog,A domesticated carnivorous mammal with four legs and a tail,"Cat, Bird","Canine, Pooch, Hound",I take my dog for a walk every day.,1 class
663,Elephant,"A large, gray mammal with a long nose and two tusks","Tiny, Small","Pachyderm, Mammoth, Ivory",The elephant at the zoo is so big!,1 class
664,Frog,A cold-blooded amphibian with a smooth skin and long legs for jumping,None,"Toad, Polliwog, Bullfrog",The frog jumped into the pond with a splash.,1 class
665,Girl,A female child,Boy,"Young woman, Daughter, Sister",I have a lot of fun playing with my friends who are girls.,1 class
666,Hat,A head covering worn for warmth or as a fashion accessory,None,"Cap, Bonnet, Beanie",I always wear a hat when it's cold outside.,1 class
667,Ice cream,"A frozen dessert made from milk, cream, sugar, and flavorings",None,"Gelato, Sorbet, Sherbet",I love to eat ice cream on a hot day.,1 class
668,Juice,A drink made from squeezed fruit or vegetables,None,"Nectar, Beverage, Refreshment",My favorite juice is apple juice.,1 class
669,Kite,A toy consisting of a light frame covered with paper or fabric that is flown in the air by a string,None,"Flying toy, Delta, Diamond",We flew a kite at the park on a windy day.,1 class
670,Lion,"A large, carnivorous feline animal with a mane around the neck",None,"King of the jungle, Panthera, Cat",The lion roared loudly at the zoo.,1 class
671,Moon,"The natural satellite of the Earth, visible at night as a bright object in the sky","Sun, Star","Luna, Crescent, Full",The moon looks so pretty tonight!,1 class
672,Nose,The part of the face that protrudes above the mouth and is used for breathing and smelling,"Mouth, Chin","Snout, Proboscis, Nostril",I sneezed and wiped my nose with a tissue.,1 class
673,Owl,A nocturnal bird of prey with large eyes and a hooked beak,None,"Bird of the night, Hooter, Screech",The owl hooted in the tree outside my window.,1 class
674,Pizza,"A dish consisting of a flattened bread dough topped with tomato sauce, cheese, and other toppings",None,"Pie, Slice, Margherita",I love to eat pizza with my favorite toppings.,1 class
675,Queen,A female ruler of a country,"King, President","Monarch, Empress, Princess",The queen wore a beautiful crown and gown.,1 class
676,Water,"A clear liquid that has no taste or smell, and is essential for most forms of life","Dryness, Aridity, Dehydration, Parchedness","H2O, Aqua, Fluid, Wetness",I drink water when I am thirsty.,1 class
677,Worm,"A long, thin creature with no legs or arms, that lives in soil","Mammal, Reptile, Fish, Bird","Invertebrate, Annelid, Nematode, Creature",The worm crawled out of the apple.,1 class
678,Window,An opening in a wall or door that lets in light and air and allows you to see outside,"Wall, Door, Brick, Barrier","Pane, Opening, Portal, Casement",I look out of the window to see the rain.,1 class
679,World,"The earth, together with all of its countries and peoples","Space, Cosmos, Galaxy, Void","Planet, Globe, Earth, Universe",The world is a big place with many different cultures.,1 class
680,Watch,A small timepiece worn on the wrist or carried in a pocket,"Forget, Ignore, Neglect, Miss","Timepiece, Clock, Wristwatch, Stopwatch",I always wear my watch so I know when it's time to go home.,1 class
681,Wind,"The movement of air in the atmosphere, especially a natural and perceptible movement of air","Stillness, Calm, Silence, Inactivity","Breeze, Gust, Draft, Zephyr",The wind blew so hard that it knocked over my chair.,1 class
682,Whale,A very large marine mammal that lives in the ocean,"Land animal, Bird, Fish, Reptile","Cetacean, Moby Dick, Leviathan, Mammal",I saw a whale jump out of the water on TV.,1 class
683,Wig,A covering of artificial hair worn on the head to hide a bald spot or for fun,"Natural hair, Baldness, Shaved head, Short hair","Hairpiece, Toupee, Weave, Extension",I wore a wig to my Halloween party.,1 class
684,Watermelon,"A large, round fruit with green skin, pink flesh, and black seeds","Sour, Bitter, Unripe, Dry","Fruit, Melon, Citrullus lanatus, Sweet",I love to eat watermelon on hot summer days.,1 class
685,Wall,A structure that encloses an area or divides one area from another,"Opening, Entrance, Gate, Door","Barrier, Partition, Divider, Separator",The wall of the castle was very tall and thick.,1 class
686,Wormhole,A hypothetical tunnel-like connection through space-time that could create shortcuts for long journeys across the universe,"Realism, Science, Physics, Logic","Hyperspace, Stargate, Portal, Black hole","In science fiction, spaceships travel through wormholes to reach faraway planets.",1 class
687,Wish,A desire or hope for something to happen,"Reality, Fact, Certainty, Truth","Desire, Dream, Aspiration, Ambition",I wish for a puppy for my birthday.,1 class
688,Winter,"The coldest season of the year, occurring between autumn and spring","Warm, Hot, Summer, Spring","Cold, Snowy, Frosty, Freezing",I wear a warm coat and hat in winter to stay cozy.,1 class
689,Wolf,"A wild carnivorous mammal of the dog family, living and hunting in packs","Prey, Herbivore, Domestic animal, Pet","Canine, Predator, Hunter, Beast",The wolf howled at the moon in the dark forest.,1 class
690,Orange,A round citrus fruit with a tough bright reddish-yellow skin and sweet or sour juicy pulp.,"Apple, Banana, Pear, Plum","Citrus, Tangerine, Mandarin, Clementine",I ate an orange after lunch today.,1 class
691,One,Referring to the number 1.,"Multiple, Several, Many, Numerous","Single, Solitary, Unique, Individual",I have one pencil in my pencil case.,1 class
692,Owl,A nocturnal bird of prey with large eyes and a hooked beak.,"Dove, Pigeon, Finch, Canary","Bird of prey, Raptor, Falcon, Eagle",The owl hoots at night.,1 class
693,Ocean,"A very large expanse of sea, in particular each of the main areas into which the sea is divided geographically.","Land, Island, Continent, Shore","Sea, Seawater, Brine, Main",The ocean is so vast and deep.,1 class
694,Octopus,"A cephalopod mollusk with eight sucker-bearing arms, a soft sac-like body, and a beak, typically able to change color or release ink for defense.","Mammal, Bird, Fish, Reptile","Squid, Cuttlefish, Nautilus, Mollusk",The octopus is a fascinating sea creature.,1 class
695,Oval,A shape like a stretched circle or an egg.,"Square, Rectangle, Triangle, Circle","Ellipse, Ovoid, Oblong, Egg-shaped",The football field is oval-shaped.,1 class
696,Orange Juice,"A drink made from oranges, usually served at breakfast.","Cola, Lemonade, Soda, Energy drink","Fruit juice, Citrus juice, Breakfast juice, Fresh juice",I had a glass of orange juice with my breakfast.,1 class
697,Ostrich,"A large flightless bird with a long neck, long legs, and two toes on each foot.","Pigeon, Finch, Canary, Sparrow","Bird, Fowl, Emu, Cassowary",The ostrich is the fastest bird on land.,1 class
698,Oak,"A tree that bears acorns as fruit, and typically has lobed deciduous leaves.","Bush, Shrub, Palm, Fern","Tree, Hardwood, Forest, Grove",The oak tree has strong and sturdy wood.,1 class
699,Open,"Allowing access, passage, or a view through an empty space.","Closed, Shut, Sealed, Private","Unlocked, Unsealed, Accessible, Available",Please leave the door open.,1 class
700,Old,"Having lived for a long time, no longer young.","Young, New, Fresh, Modern","Aged, Elderly, Senior, Ancient",My grandfather is very old.,1 class
701,Onion,"A swollen edible bulb used as a vegetable, having a pungent taste and smell and composed of several concentric layers.","Fruit, Grape, Pear, Orange","Vegetable, Shallot, Scallion, Leek",The onion makes me cry when I cut it.,1 class
702,Out,"Moving or appearing to move away from a particular place, especially one that is enclosed or hidden.","Inside, Interior, Within, Present","Outside, Exterior, Beyond, Absent",Let's go out and play in the sun.,1 class
703,Mango,A sweet fruit,None,"Nectarine, peach",I love to eat mangoes in the summer.,1 class
704,Mouse,A small rodent,"Cat, dog","Rat, rodent",A mouse lives in a hole in the wall.,1 class
705,Music,Sound in a pleasing arrangement,"Noise, cacophony","Melody, harmony",I like to dance to music.,1 class
706,Moon,A natural satellite of the Earth,"Sun, Earth","Satellite, orbit",The moon looks beautiful in the night sky.,1 class
707,Monkey,A type of primate,None,"Ape, baboon",The monkey swung from tree to tree.,1 class
708,Map,A visual representation of an area,None,"Atlas, chart",We used a map to find our way to the park.,1 class
709,Mail,Letters and packages delivered by post,None,"Post, letters",My grandmother sent me a letter in the mail.,1 class
710,Meat,Animal flesh used as food,"Vegetables, fruits","Beef, pork",I like to eat chicken meat.,1 class
711,Money,A medium of exchange,None,"Currency, cash",You need money to buy things.,1 class
712,Marker,A writing tool,"Eraser, chalk","Pen, pencil",I used a marker to draw a picture.,1 class
713,Mountain,A large natural elevation of the earth's surface,"Valley, plain","Hill, peak",We hiked up the mountain to see the view.,1 class
714,Mouth,The opening in the face used for eating and speaking,"Ears, nose","Lips, jaws",I used my mouth to eat the cookie.,1 class
715,Mitten,A type of glove that covers the hand and thumb separately,None,"Glove, hand warmer",I wore my mittens to play in the snow.,1 class
716,Mother,A female parent,"Father, dad","Mom, mommy",My mother made me breakfast.,1 class
717,Movie,A story or event recorded on film or video,None,"Film, cinema",I watched a movie with my family.,1 class
718,Mousepad,A surface for a computer mouse,None,None,I need a mousepad to use my computer mouse.,1 class
719,Morning,The early part of the day,"Evening, night","Dawn, daybreak",I woke up early in the morning.,1 class
720,Moonlight,Light from the moon,Darkness,"Moonbeam, lunar light",The moonlight shone through my window.,1 class
721,Match,A tool used to light a fire,None,"Lighter, flint",We used a match to light the candle.,1 class
722,Marker,A scoring play in some sports,None,"Point, goal",My team scored a marker in the hockey game.,1 class
723,School,A place where children go to learn,"Home, Vacation, Holiday","Academy, Institution, College",I'm excited to go to school today!,1 class
724,Sun,The star that is the center of the solar system,"Moon, Night, Darkness","Star, Sol, Daystar",The sun is shining brightly in the sky.,1 class
725,Smile,An expression of happiness or amusement,"Frown, Scowl, Glower","Grin, Beam, Cheer",My mom always tells me to smile for pictures.,1 class
726,Socks,A garment worn on the feet,"Barefoot, Sandals, Slippers","Stockings, Hose, Footwear",I need to put on my socks before I go outside.,1 class
727,Spoon,A utensil used for eating or serving food,"Fork, Knife, Chopsticks","Scoop, Ladle, Utensil","Can I have a spoon for my soup, please?",1 class
728,Snack,A small amount of food eaten between meals,"Meal, Feast, Banquet","Treat, Nibble, Munch",I brought a snack to eat during recess.,1 class
729,Swing,"A seat suspended by ropes or chains, used as a plaything","Still, Stable, Grounded","Sway, Rock, Dangle",I love to swing on the playground.,1 class
730,Shoes,Footwear that covers the feet and sometimes the ankles,"Barefoot, Slippers, Flip-flops","Sneakers, Sandals, Boots",I need to tie my shoes before I run.,1 class
731,Sheep,"A domesticated mammal used for wool, meat, and milk","Wolf, Fox, Predator","Lamb, Ewe, Ram",Look at all the sheep in the farm field.,1 class
732,Snail,"A mollusk with a spiral shell, often slow-moving","Cheetah, Rabbit, Speedy","Slug, Escargot, Conch",The snail crawled slowly across the sidewalk.,1 class
733,Spider,"An arachnid with eight legs, often seen spinning webs","Mammal, Bird, Fish","Arachnid, Tarantula, Insect","I'm scared of spiders, they're creepy.",1 class
734,Star,A luminous celestial body visible in the sky,"Earth, Moon, Comet","Sun, Planet, Galaxy",I saw a shooting star in the night sky.,1 class
735,Story,"A narrative, either true or fictional","Fact, Reality, News","Tale, Fable, Legend",My teacher read us a story during storytime.,1 class
736,Squirrel,"A small rodent with a bushy tail, often seen gathering nuts","Cat, Dog, Predator","Chipmunk, Rat, Mouse",Look at the squirrel climbing up the tree.,1 class
737,Swim,To move through water using one's arms and legs,"Sink, Drown, Sunk","Float, Dive, Splash",I want to learn how to swim like a fish.,1 class
738,Sneeze,To expel air forcibly through the nose and mouth due to irritation,"Silence, Quiet, Mute","Achoo, Snort, Blow",I need to cover my mouth when I sneeze.,1 class
739,Slide,"A piece of equipment used for children's play, often seen on a playground","Stairs, Ladder, Climber","Chute, Slip, Glider",Let's go down the slide together!,1 class
740,Umbrella,A device used to protect from rain or sunlight,"Sunburn, Wetness, Exposure, Vulnerability","Parasol, Brolly, Shade, Canopy",My mom gave me an umbrella so I wouldn't get wet in the rain.,1 class
741,Unicorn,A mythical creature resembling a horse with a single horn on its head,"Realistic animal, Rhinoceros, Donkey, Mule","Magical horse, Alicorn, Pegasus, Fairy horse",I love unicorns because they are magical creatures with one horn.,1 class
742,Uncle,The brother of one's parent,"Stranger, Enemy, Unrelated, Foe","Aunt, Niece, Nephew, Relative",My uncle is coming to visit us this weekend.,1 class
743,Up,Moving or situated higher,"Down, Low, Below, Underneath","Elevated, Upward, Skyward, Vertical",I climbed up the tree to get a better view.,1 class
744,Use,The act of employing something for a purpose,"Neglect, Disuse, Abandonment, Inactivity","Utilization, Application, Implementation, Exercise",I can use this pencil to write my name.,1 class
745,Understand,To comprehend or grasp the meaning of something,"Misunderstand, Misinterpret, Confuse, Ignore","Comprehend, Grasp, Perceive, Fathom",I understand how to do this math problem now.,1 class
746,University,A higher education institution where one can earn a degree,"Dropout, Illiterate, Uneducated, Ignorant","College, Academy, School, Institute",My dad went to university to become a doctor.,1 class
747,Uniform,A particular set of clothes worn by members of an organization or profession,"Casual wear, Non-uniform, Out of uniform, Unsuited","Outfit, Attire, Costume, Dress",The soldiers wore green uniforms to camouflage in the forest.,1 class
748,Unit,A single thing or person regarded as a whole,"Division, Separation, Disunity, Fragmentation","Entity, Element, Component, Item",My teacher gave us a unit of candies to share with the class.,1 class
749,Uncle,The brother of one's parent,"Stranger, Enemy, Unrelated, Foe","Aunt, Niece, Nephew, Relative",My uncle is coming to visit us this weekend.,1 class
750,Urge,A strong desire or impulse to do something,"Repulsion, Dislike, Aversion, Inhibition","Craving, Longing, Impetus, Instinct",I feel the urge to jump up and down when I'm excited.,1 class
751,Upset,"To become unhappy, disappointed, or worried","Calm, Content, Cheerful, Untroubled","Distressed, Troubled, Agitated, Perturbed",I was upset when I lost my favorite toy.,1 class
752,Ugly,Unpleasant or unattractive in appearance,"Beautiful, Attractive, Gorgeous, Handsome","Unsightly, Homely, Unappealing, Repulsive",That painting is ugly because it has weird colors.,1 class
753,Unique,Being the only one of its kind,"Ordinary, Common, Average, Typical","One-of-a-kind, Distinctive, Exclusive, Rare",My house is unique because it has a giant treehouse in the backyard.,1 class
754,Unhappy,Feeling sad or displeased,"Happy, Joyful, Pleased, Content","Sad, Depressed, Miserable, Sorrowful",I am unhappy because my father didn't bought me new toy.,1 class
755,Name,A word or set of words by which a person or thing is known,"Unknown, Anonymous, Unnamed, Nameless","Title, Appellation, Denomination, Moniker",My name is Jack.,1 class
756,Nature,"The physical world, including all living things and natural phenomena","Artificial, Manufactured, Synthetic, Unnatural","Environment, Universe, Creation, Earth",The beauty of nature is breathtaking.,1 class
757,Nurse,"A person trained to care for the sick or infirm, especially in a hospital","Patient, Invalid, Sick, Unhealthy","Attendant, Caregiver, Medic, Practitioner",The nurse checked my temperature.,1 class
758,Nest,A structure or place made or chosen by a bird for laying eggs and sheltering its young,"Unsheltered, Exposed, Unprotected, Vulnerable","Roost, Den, Lair, Refuge",The bird built a nest in the tree.,1 class
759,Net,A meshed fabric or structure used as a barrier to trap or catch things,"Open, Unobstructed, Uncovered, Free","Mesh, Web, Network, Screen",The fish was caught in the net.,1 class
760,Nine,The number equivalent to the product of three and three; one less than ten,"Zero, One, Two, Eight","Niner, Nonagon, Ennead, IX",I have nine fingers on my hands.,1 class
761,Noon,Twelve o'clock in the day; midday,"Midnight, Dusk, Dawn, Nightfall","Midday, Noontime, High Noon, Meridian",Lunch is at noon.,1 class
762,Nose,"The part of the face or head containing the nostrils, used for breathing and smelling","Mouth, Ears, Eyes, Chin","Snout, Proboscis, Sniffer, Schnozzle",I blew my nose.,1 class
763,Note,A brief record of something written down to assist the memory or for future reference,"Forget, Ignore, Neglect, Disregard","Memo, Memorandum, Jotting, Reminder",I took a note during class.,1 class
764,Nut,A fruit consisting of a hard or tough shell around an edible kernel,"Fruit, Vegetable, Meat, Candy","Kernel, Seed, Pit, Stone",I love eating nuts.,1 class
765,Near,At or to a short distance away; not far away,"Distant, Far, Faraway, Remote","Close, Adjacent, Proximate, Nigh",The store is near my house.,1 class
766,Nice,"Pleasant, agreeable, or satisfactory","Unpleasant, Mean, Rude, Harsh","Pleasant, Agreeable, Amiable, Friendly",The weather is nice today.,1 class
767,New,Not existing before; newly made or acquired,"Old, Used, Worn, Ancient","Fresh, Modern, Novel, Recent",I got a new toy.,1 class
768,Noon,Twelve o'clock in the day; midday,"Midnight, Dusk, Dawn, Nightfall","Midday, Noontime, High Noon, Meridian",Lunch is at noon.,1 class
769,Noisy,Making a lot of noise; loud,"Quiet, Hushed, Silent, Calm","Loud, Clamorous, Boisterous, Raucous",The kids were very noisy in class.,1 class
770,Happy,Feeling or expressing joy,"Sad, unhappy, gloomy, miserable","Pleased, delighted, content, cheerful",The kids were very happy to see their grandparents.,1 class
771,Hat,A covering for the head,"Baldness, bareheaded, hairless, uncrowned","Cap, beanie, fedora, beret",He put on his favorite hat before going outside.,1 class
772,House,A building where people live,"Office, factory, store, school","Home, residence, dwelling, abode",The family moved into a new house on the other side of town.,1 class
773,Hand,"The part of the body at the end of the arm, including the fingers and thumb","Foot, arm, leg, head","Palm, fist, fingers, grip",He used his hand to pick up the toy.,1 class
774,Head,"The upper part of the body, which contains the brain and other important organs","Feet, tail, legs, body","Mind, brain, intellect, intelligence",She had a headache after studying for too long.,1 class
775,Help,To assist or give support to someone or something,"Hinder, obstruct, impede, block","Aid, assist, support, lend a hand",Can you help me carry these books to the library?,1 class
776,Hungry,Feeling the need to eat,"Full, satisfied, satiated, content","Starving, famished, ravenous, peckish",He was so hungry that he ate two sandwiches for lunch.,1 class
777,Hello,A greeting or expression of goodwill when meeting someone,"Goodbye, farewell, adieu, so long","Hi, hey, greetings, salutations",She greeted her friend with a friendly hello.,1 class
778,Heart,The organ that pumps blood throughout the body,"Brain, head, intellect, reason","Core, essence, center, soul",He could feel his heart pounding in his chest during the race.,1 class
779,Hide,To conceal or cover something,"Reveal, expose, uncover, display","Conceal, cover, mask, obscure",The cat likes to hide under the bed when it's scared.,1 class
780,Hair,The strands that grow on the head or body,"Baldness, bald, shaven, hairless","Locks, mane, tresses, strands",She brushed her long hair before going to bed.,1 class
781,Hot,Having a high temperature,"Cold, cool, freezing, frigid","Warm, heated, boiling, scorching",The soup was too hot to eat right away.,1 class
782,Houseplant,A plant that is grown indoors,"Outdoor plant, garden plant, wild plant, weed","Indoor plant, potted plant, foliage, greenery",She watered her houseplants every Sunday.,1 class
783,Hurt,To cause physical or emotional pain,"Heal, repair, mend, soothe","Injure, damage, harm, wound",The boy hurt his knee while playing soccer.,1 class
784,Heavy,Weighing a lot or difficult to move,"Light, easy, agile, nimble","Weighty, burdensome, cumbersome, ponderous",The box was too heavy for her to lift by herself.,1 class
785,High,Elevated or at a great distance from the ground,"Low, short, small, squat","Tall, towering, lofty, soaring",The airplane flew high above the clouds.,1 class
786,Housefly,A common fly that is often found indoors,"Butterfly, ladybug, moth, bee","Fly, house bug, insect, pest",The housefly landed on the window sill.,1 class
787,Yellow,A color between green and orange on the spectrum of visible light,"Blue, green, purple, black","Gold, lemon, saffron, amber",The sunflower had bright yellow petals.,1 class
788,Yes,An affirmative response or agreement,"No, never, absolutely not, definitely not","Affirmative, certainly, absolutely, agreed",She said yes when her friend asked to borrow a pencil.,1 class
789,Yo-yo,"A toy consisting of two disks connected by an axle and a string, which is rolled up and down","Book, computer, video game, phone","Toy, plaything, spinner, whirligig",The boy played with his yo-yo during recess.,1 class
790,Yawn,To open one's mouth wide and inhale deeply due to tiredness or boredom,"Cheer, energize, invigorate, stimulate","Stretch, gape, sigh, breathe",The baby yawned before falling asleep.,1 class
791,Year,"A period of 12 months, beginning on January 1st and ending on December 31st","Day, week, hour, minute","Twelve months, annum, cycle, season",She had a great year in first grade.,1 class
792,Yesterday,The day before today,"Today, tomorrow, future, next","Past, former, previous, last",She saw her friend at the park yesterday.,1 class
793,Yogurt,A dairy product made by fermenting milk with bacteria culture,"Bacon, steak, chicken, fish","Curd, cream, sour cream, kefir",She had a cup of yogurt for breakfast.,1 class
794,Yacht,A large sailing vessel used for pleasure or sport,"Car, airplane, train, bus","Boat, ship, cruiser, sailboat",She saw a yacht sailing on the ocean.,1 class
795,Yellow Submarine,A song by the Beatles about a submarine that is yellow in color,"Silence, quiet, noiseless, soundless","Song, music, melody, tune",She listened to Yellow Submarine on the radio.,1 class
796,Yodel,A style of singing characterized by rapid alternation between low and high notes,"Mute, silence, hush, quiet","Sing, chant, vocalize, trill",She learned how to yodel during music class.,1 class
797,Yak,A long-haired bovine animal native to the Himalayas,"Sheep, goat, horse, pig","Bull, ox, buffalo, cow",She saw a yak at the zoo.,1 class
798,Yellow Jacket,A type of wasp with yellow and black stripes,"Butterfly, ladybug, moth, beetle","Wasp, hornet, bee, insect",She was stung by a yellow jacket while playing outside.,1 class
799,Yarn,A type of thread made of fibers used for knitting or weaving,"Fabric, cloth, garment, clothing","Thread, fiber, string, wool",She knitted a scarf using colorful yarn.,1 class
800,Yummy,Delicious or tasty,"Disgusting, unpleasant, unappetizing, inedible","Delicious, delectable, tasty, appetizing",She said the cake was yummy.,1 class
801,Yard,"A unit of measurement equal to three feet, used to measure length","Square, cube, circle, triangle","Feet, meters, inches, centimeters",The fence around the yard was made of wood.,1 class
802,Yellow Belt,A ranking in martial arts below green belt and above white belt,"Unranked, beginner, novice, amateur","Ranking, level, degree, status",He earned his yellow belt in karate.,1 class
803,Cat,A small carnivorous mammal with fur and retractable claws,"Dog, bird, fish, lizard","Feline, kitty, kitten, tomcat",She saw a black cat on the fence.,1 class
804,Cake,"A sweet baked dessert made of flour, sugar, eggs, and butter or oil","Vegetable, meat, fruit, sandwich","Pastry, dessert, confection, treat",She had a slice of chocolate cake for her birthday.,1 class
805,Class,A group of students who are taught together,"Individual, one-on-one, private, personal","Lesson, course, session, seminar",She is in the same class as her best friend.,1 class
806,Computer,"An electronic device used for storing, processing, and retrieving data","Pen, paper, chalkboard, textbook","Laptop, desktop, tablet, smartphone",She used the computer to do her homework.,1 class
807,Car,A four-wheeled motor vehicle used for transportation,"Bike, skateboard, scooter, roller skates","Automobile, vehicle, sedan, coupe",She rode in the car with her family.,1 class
808,Cow,"A large domesticated mammal with hooves and horns, raised for meat, milk, and hides","Cat, dog, bird, fish","Bovine, cattle, heifer, ox",She saw a cow on the farm.,1 class
