id,simile,meaning,example,relevance
559,Known like the back of one's hand,"Very familiar with something, like the back of one's hand","The tour guide knew the city like the back of her hand, showing the tourists around with ease.",1 class
560,Kicked up a fuss,Made a big commotion or disturbance,The child kicked up a fuss when it was time for bed.,1 class
561,Kind as a daisy,Very sweet and kind,"The old woman was kind as a daisy, always offering a smile.",1 class
562,As fierce as a tiger,Very strong and aggressive,"The athlete was as fierce as a tiger, dominating the competition.",1 class
563,As brave as a tiger,Very courageous and fearless,"The soldier was as brave as a tiger, risking his life for his country.",1 class
564,As quick as a tiger,Very fast and agile,"The dancer was as quick as a tiger, moving with grace and speed.",1 class
565,As sly as a tiger,Very cunning and deceitful,"The politician was as sly as a tiger, always looking for an advantage.",1 class
566,As powerful as a tiger,Very strong and mighty,"The hurricane was as powerful as a tiger, causing widespread damage.",1 class
567,As ferocious as a tiger,Very violent and aggressive,"The storm was as ferocious as a tiger, with winds tearing through the streets.",1 class
568,As agile as a tiger,Very graceful and nimble,"The gymnast was as agile as a tiger, performing amazing feats of acrobatics.",1 class
569,As proud as a tiger,Very confident and self-assured,"The artist was as proud as a tiger, showing off his latest masterpiece.",1 class
570,As wild as a tiger,Very untamed and unpredictable,"The child was as wild as a tiger, running through the playground without a care.",1 class
571,As stealthy as a tiger,Very sneaky and secretive,"The spy was as stealthy as a tiger, slipping in and out of enemy territory undetected.",1 class
572,As majestic as a tiger,Very grand and regal,"The king was as majestic as a tiger, commanding respect and admiration from his people.",1 class
573,As menacing as a tiger,Very threatening and dangerous,"The criminal was as menacing as a tiger, instilling fear in all who crossed his path.",1 class
574,As relentless as a tiger,Very persistent and determined,"The marathon runner was as relentless as a tiger, pushing himself to the limit.",1 class
575,As hungry as a tiger,Very hungry and ready to eat,"The boy was as hungry as a tiger, devouring his dinner in minutes.",1 class
576,As territorial as a tiger,Very protective of one's territory,"The dog was as territorial as a tiger, barking at anyone who came near his yard.",1 class
577,As curious as a tiger,Very interested and inquisitive,"The scientist was as curious as a tiger, always seeking new knowledge.",1 class
578,As focused as a tiger,Very concentrated and attentive,"The student was as focused as a tiger, studying hard for his exams.",1 class
579,As patient as a tiger,"Very calm and composed, able to wait for what they want","The fisherman was as patient as a tiger, waiting for hours for a catch.",1 class
580,As playful as a tiger,Very lively and fun-loving,"The children were as playful as tigers, running around and laughing.",1 class
581,As dangerous as a tiger,Very risky or unsafe,"The mountain trail was as dangerous as a tiger, with steep drops and narrow paths",1 class
238,As blind as a bat,Unable to see well,"Without my glasses, I'm as blind as a bat.",3 class
239,As busy as a bee,Very active and hardworking,"The worker bee was as busy as a bee, buzzing from flower to flower.",3 class
240,As cool as a cucumber,Calm and composed,"Even in the face of danger, he was as cool as a cucumber.",3 class
241,As cute as a button,Adorable,The little girl was as cute as a button in her new dress.,3 class
242,As easy as pie,Very easy,The math problem was as easy as pie for the smart student.,3 class
243,As fast as lightning,Extremely quick,"The cheetah ran as fast as lightning, leaving all the other animals behind.",3 class
244,As fit as a fiddle,In very good health,"The athlete was as fit as a fiddle, able to run for miles without getting tired.",3 class
245,As flat as a pancake,Completely flat,The pancake was cooked until it was as flat as a pancake.,3 class
246,As free as a bird,Liberated and carefree,"After finishing the project, the students felt as free as a bird.",3 class
247,As gentle as a lamb,Kind and gentle,The mother cat was as gentle as a lamb with her newborn kittens.,3 class
248,As good as gold,Very well-behaved,The child was as good as gold during the entire trip.,3 class
249,As happy as a clam,Very happy and content,"After receiving her present, the little girl was as happy as a clam.",3 class
250,As hard as nails,Very tough,The boxer was as hard as nails and could take a lot of punches.,3 class
251,As hot as fire,Very hot,"The chili peppers were as hot as fire, causing his mouth to burn.",3 class
252,As hungry as a bear,Very hungry,"After skipping lunch, she was as hungry as a bear.",3 class
253,As light as a feather,Very light,"The bird was as light as a feather, easily lifting off the ground.",3 class
254,As quick as a flash,Very fast,"The lightning struck as quick as a flash, illuminating the entire sky.",3 class
255,As quiet as a mouse,Very quiet,"The baby was sleeping as quiet as a mouse, not making a sound.",3 class
256,As sick as a dog,Very sick,"After eating too much candy, he felt as sick as a dog.",3 class
257,As slow as a snail,Very slow,"The old turtle was as slow as a snail, taking hours to cross the road.",3 class
258,As sly as a fox,Clever and cunning,"The cat was as sly as a fox, always finding a way to catch the mouse.",3 class
259,As steady as a rock,Very stable and reliable,The experienced sailor was as steady as a rock in rough seas.,3 class
260,As strong as an ox,Very strong,"The weightlifter was as strong as an ox, easily lifting heavy weights.",3 class
261,As sweet as honey,Very sweet,"The dessert was as sweet as honey, making everyone's mouth water.",3 class
262,As tall as a giraffe,Very tall,"The basketball player was as tall as a giraffe, towering over his opponents.",3 class
263,As tough as leather,Very durable,The leather jacket was as tough as leather and could withstand rough use.,3 class
264,As white as snow,Completely white,"The snow was as white as snow, sparkling in the sunlight.",3 class
265,Happy as a clam,Very happy and content,"After getting a new toy, he was as happy as a clam.",3 class
266,Hard as nails,Very tough and strong,The old tree was hard as nails.,3 class
267,Hard as rock,Very hard and unbreakable,The stone was hard as rock.,3 class
268,Hard as steel,Very strong and difficult to bend or break,The door was hard as steel.,3 class
269,Heavy as lead,Very heavy and difficult to lift,The box was heavy as lead.,3 class
270,High as a kite,Very excited or happy,The boy was high as a kite after winning the race.,3 class
271,Hot as fire,Very hot and burning,The soup was hot as fire.,3 class
272,Hungry as a bear,Very hungry,"After the game, he was hungry as a bear.",3 class
273,Hungry as a horse,Very hungry,"After the long walk, she was hungry as a horse.",3 class
274,Hungry as a wolf,Very hungry,The boy was hungry as a wolf after playing for hours.,3 class
275,Happy as a lark,Very happy and content,She was happy as a lark after getting a surprise gift.,3 class
276,Happy as a clam at high water,Very happy and content in any situation,"Even though the weather was bad, he was happy as a clam at high water.",3 class
277,Happy as a flea in a doghouse,Very happy and content in an unusual situation,The boy was happy as a flea in a doghouse when he got to play with his favorite toy.,3 class
278,Happy as a puppy with two tails,Very happy and excited,"After winning the game, the team was happy as a puppy with two tails.",3 class
279,Happy as a kid in a candy store,Very happy and excited,The children were happy as kids in a candy store when they got to choose their own candy.,3 class
280,Happy as a pig in mud,Very happy and content in a dirty or messy situation,The baby was happy as a pig in mud after playing in the garden.,3 class
281,Heavy as a brick,Very heavy and difficult to lift,The bag was heavy as a brick.,3 class
282,Heavy as a boulder,Very heavy and difficult to move,The rock was heavy as a boulder.,3 class
283,Heavy as an elephant,Very heavy and difficult to lift,The couch was heavy as an elephant.,3 class
284,High as the clouds,Very high up,The airplane was flying as high as the clouds.,3 class
285,High as the hills,Very high up,The kite was flying as high as the hills.,3 class
286,High as a mountain,Very high up,The bird was flying as high as a mountain.,3 class
287,Hot as the sun,Very hot,The sand was hot as the sun.,3 class
288,Hot as a stove,Very hot,The tea was hot as a stove.,3 class
289,Hot as a sauna,Very hot and steamy,The room was hot as a sauna.,3 class
290,Hungry as a lion,Very hungry,"After the game, the team was hungry as a lion.",3 class
291,Hungry as a hippo,Very hungry,"After the walk, the boy was hungry as a hippo.",3 class
292,Hungry as a pack of wolves,Very hungry,The runners were hungry as a pack of wolves after the race.,3 class
293,As funny as a clown,Very amusing or comical,The clown made everyone laugh with his silly antics.,3 class
294,As funny as a barrel of monkeys,Very entertaining or amusing,The party was as funny as a barrel of monkeys with all of the jokes and laughter.,3 class
295,As funny as a jack-in-the-box,Surprising and unexpected,The punchline to the joke was as funny as a jack-in-the-box popping out.,3 class
296,As funny as a three-ring circus,Chaotic and unpredictable,The classroom was as funny as a three-ring circus during the science experiment.,3 class
297,As funny as a fart in a space suit,Silly or ridiculous,"The prank was as funny as a fart in a space suit, but it made everyone laugh.",3 class
298,As funny as a movie with Jim Carrey,Full of humor and jokes,"The comedy was as funny as a movie with Jim Carrey, and the audience couldn't stop laughing.",3 class
299,As funny as a cartoon,Amusing or humorous,"The cartoon was as funny as a slapstick comedy, and the kids loved it.",3 class
300,As funny as a tickled monkey,Hilarious or uproarious,"The joke was as funny as a tickled monkey, and everyone burst into laughter.",3 class
301,As funny as a stand-up comedian,Witty and amusing,"The comedian was as funny as a stand-up comedian, and the crowd couldn't get enough of him.",3 class
302,As funny as a clown on stilts,Comical and absurd,"The costume was as funny as a clown on stilts, and it made everyone smile.",3 class
303,As funny as a barrel of laughs,Entertaining and amusing,"The party was as funny as a barrel of laughs, and everyone had a great time.",3 class
304,As funny as a cat chasing a laser pointer,Silly and playful,"The video was as funny as a cat chasing a laser pointer, and it made everyone giggle.",3 class
305,As funny as a monkey in a suit,Ridiculous and amusing,"The photo was as funny as a monkey in a suit, and it made everyone laugh.",3 class
306,As funny as a rubber chicken,Silly or ridiculous,"The toy was as funny as a rubber chicken, and it made the kids laugh.",3 class
307,As funny as a prank call,Clever and amusing,"The joke was as funny as a prank call, and it made everyone chuckle.",3 class
308,As funny as a clown with a red nose,Comical and lighthearted,"The circus was as funny as a clown with a red nose, and it brought joy to everyone who watched.",3 class
309,As funny as a chicken crossing the road,Amusing and entertaining,"The story was as funny as a chicken crossing the road, and it made everyone laugh.",3 class
310,As funny as a clown with big shoes,Comical and silly,"The clown was as funny as a clown with big shoes, and he made everyone giggle.",3 class
311,As funny as a whoopee cushion,Amusing and silly,"The prank was as funny as a whoopee cushion, and it made everyone laugh.",3 class
312,As funny as a pie in the face,Comical and unexpected,"The joke was as funny as a pie in the face, and it made everyone laugh out loud.",3 class
313,As funny as a monkey playing the drums,Amusing and entertaining,"The video was as funny as a monkey playing the drums, and it made everyone smile.",3 class
314,As best as a champion,To perform or be the best possible,"The athlete performed as best as a champion, setting a new world record.",3 class
315,As best as a star performer,To perform exceptionally well,"The singer performed as best as a star performer, wowing the audience with their voice.",3 class
316,As best as a medalist,To achieve the highest level of success,"The student performed as best as a medalist, scoring the highest in the class.",3 class
317,As best as a superhero,To be the most successful or powerful,"The team performed as best as a superhero, winning the championship game.",3 class
318,As best as a king,To have the highest level of authority or power,"The leader ruled as best as a king, making wise decisions for the kingdom.",3 class
319,As best as a shooting star,To achieve success quickly and brilliantly,"The artist's career took off as best as a shooting star, gaining fame and success in a short amount of time.",3 class
320,As best as a race car driver,To perform at the highest level of skill and speed,"The driver performed as best as a race car driver, breaking the track record.",3 class
321,As best as a rocket ship,To achieve success quickly and efficiently,"The company grew as best as a rocket ship, quickly expanding and making profits.",3 class
322,As best as a chef,To cook the most delicious and flavorful food,"The cook prepared the meal as best as a chef, using fresh ingredients and creative techniques.",3 class
323,As best as a doctor,To provide the highest level of care and expertise,"The physician treated the patient as best as a doctor, accurately diagnosing and treating the illness.",3 class
324,As best as a teacher,To educate and inspire students to the highest level,"The educator taught the lesson as best as a teacher, engaging and motivating the students.",3 class
325,As best as a detective,To investigate and solve a mystery with the highest level of skill,"The investigator solved the case as best as a detective, using their intelligence and intuition.",3 class
326,As best as a magician,To perform tricks and illusions with the highest level of skill,"The performer amazed the audience as best as a magician, leaving them wondering how the tricks were done.",3 class
327,As best as a soldier,To fight with the highest level of bravery and skill,"The soldier served their country as best as a soldier, risking their life to protect others.",3 class
328,As best as a superheroine,To be the most successful or powerful female,"The leader fought for justice as best as a superheroine, inspiring others with her courage and strength.",3 class
329,As best as a team captain,To lead a group to the highest level of success,"The captain led the team as best as a team captain, motivating and inspiring the players to win the game.",3 class
330,As best as a traveler,To explore and discover new places with the highest level of curiosity,"The adventurer explored the world as best as a traveler, learning and experiencing new cultures.",3 class
331,As best as a singer-songwriter,To create and perform music with the highest level of creativity and talent,"The musician wrote and performed the song as best as a singer-songwriter, expressing their emotions and connecting with the audience.",3 class
332,As best as a chef cooking a five-star meal,To cook a meal of the highest quality and flavor,"The chef prepared the dinner as best as a chef cooking a five-star meal, using the freshest ingredients and precise techniques.",3 class
333,As sad as a lost puppy,Feeling lonely and abandoned,The little girl felt as sad as a lost puppy when her best friend moved away.,3 class
334,As sad as a wilted flower,Feeling deflated and lifeless,The student felt as sad as a wilted flower when they received a low grade on their test.,3 class
335,As sad as a rainy day,Feeling gloomy and depressed,The man felt as sad as a rainy day after his girlfriend broke up with him.,3 class
336,As sad as a funeral,Feeling sorrowful and mourning,The family felt as sad as a funeral after their beloved pet passed away.,3 class
337,As sad as a broken heart,Feeling emotional pain and heartbreak,The girl felt as sad as a broken heart when she found out her crush was dating someone else.,3 class
338,As sad as a dark cloud,Feeling weighed down and heavy-hearted,The woman felt as sad as a dark cloud after she lost her job.,3 class
339,As sad as a cemetery,Feeling overwhelmed with grief,The woman felt as sad as a cemetery when she lost her mother to cancer.,3 class
340,As sad as a deserted island,Feeling isolated and alone,The boy felt as sad as a deserted island when he didn't have any friends to play with.,3 class
341,As sad as a rainy Monday morning,Feeling unmotivated and uninspired,The student felt as sad as a rainy Monday morning when they had to go to school after a long weekend.,3 class
342,As sad as a dark and stormy night,Feeling scared and alone,The child felt as sad as a dark and stormy night when they couldn't sleep because of a thunderstorm.,3 class
343,As sad as a broken toy,Feeling disappointed and let down,The little boy felt as sad as a broken toy when his favorite toy broke.,3 class
344,As sad as a lost treasure,Feeling regretful and nostalgic,The woman felt as sad as a lost treasure when she remembered the memories of her childhood home.,3 class
345,As sad as a song with no melody,Feeling empty and unfulfilled,The musician felt as sad as a song with no melody when they couldn't come up with any new ideas for a song.,3 class
346,As sad as a blank canvas,Feeling uninspired and uncreative,The artist felt as sad as a blank canvas when they couldn't think of anything to paint.,3 class
347,As sad as a muted TV,Feeling disconnected and uninterested,The man felt as sad as a muted TV when he realized he had no one to watch the game with.,3 class
348,As sad as a silent room,Feeling lonely and forgotten,The child felt as sad as a silent room when their parents forgot to pick them up from school.,3 class
349,As sad as a forgotten birthday,Feeling unimportant and neglected,The girl felt as sad as a forgotten birthday when none of her friends remembered her special day.,3 class
350,As sad as a broken promise,Feeling disappointed and let down,The woman felt as sad as a broken promise when her friend didn't show up to their planned outing.,3 class
351,As sad as a dull knife,Feeling ineffective and useless,The chef felt as sad as a dull knife when they couldn't cut through the vegetables.,3 class
352,As sad as a flat tire,Feeling frustrated and stranded,The man felt as sad as a flat tire when his car broke down on the side of the road.,3 class
353,As sad as a sunken ship,Feeling defeated and hopeless,The team felt as sad as a sunken ship when they lost the championship game.,3 class
119,As busy as a bee,Very active and hardworking,"She was as busy as a bee, running from one task to another.",4 class
120,As clean as a whistle,Very clean and pure,The room was as clean as a whistle after she finished tidying up.,4 class
121,As clear as crystal,Very clear and easy to understand,Her explanation was as clear as crystal and everyone understood it.,4 class
122,As cool as a cucumber,Very calm and composed,"Even in a crisis, he remained as cool as a cucumber and made smart decisions.",4 class
123,As cute as a button,Very adorable and charming,The puppy was as cute as a button and everyone wanted to pet him.,4 class
124,As easy as pie,Very easy and simple,The math problem was as easy as pie and she solved it in no time.,4 class
125,As fast as lightning,Very quick and rapid,He ran as fast as lightning to catch up with the other runners.,4 class
126,As flat as a pancake,Very flat and even,The road was as flat as a pancake and made for a smooth bike ride.,4 class
127,As free as a bird,Very free and unencumbered,She felt as free as a bird when she finally finished her exams.,4 class
128,As fresh as a daisy,Very fresh and new,The flowers were as fresh as a daisy and smelled wonderful.,4 class
129,As gentle as a lamb,Very gentle and kind,The new teacher was as gentle as a lamb and the students loved her.,4 class
130,As good as gold,Very good and well-behaved,The children were as good as gold during the field trip.,4 class
131,As happy as a clam,Very happy and content,She was as happy as a clam when she received an A on her test.,4 class
132,As hard as a rock,Very hard and solid,The diamond was as hard as a rock and difficult to cut.,4 class
133,As heavy as a brick,Very heavy and dense,The box was as heavy as a brick and difficult to carry.,4 class
134,As high as a kite,Very high and elevated,The airplane was flying as high as a kite in the sky.,4 class
135,As hot as fire,Very hot and intense,The sun was as hot as fire on the beach that day.,4 class
136,As hungry as a wolf,Very hungry and ravenous,He was as hungry as a wolf after his long hike.,4 class
137,As light as a feather,Very light and weightless,The bird was as light as a feather and could fly easily.,4 class
138,As loud as thunder,Very loud and powerful,The thunder was as loud as thunder and made the ground shake.,4 class
139,As mad as a hatter,Very angry and irrational,He was as mad as a hatter when he found out his bike was stolen.,4 class
140,As neat as a pin,Very neat and organized,Her desk was as neat as a pin and everything had its place.,4 class
141,As old as the hills,Very old and ancient,The castle was as old as the hills and had a rich history.,4 class
142,As pale as a ghost,Very pale and white,She looked as pale as a ghost after hearing the bad news.,4 class
143,As quiet as a mouse,Very quiet and silent,The library was as quiet as a mouse and you could hear a pin drop.,4 class
144,As quick as a flash,Very quick and fast,He caught the ball as quick as a flash and threw it back to the pitcher.,4 class
145,As calm as a pond,Very calm and peaceful,"The lake was as calm as a pond, reflecting the trees and sky.",4 class
146,As clear as day,Very clear and obvious,It was as clear as day that she was the best candidate for the job.,4 class
147,As cold as ice,Very cold and frigid,The snow was as cold as ice and made her fingers numb.,4 class
148,As common as dirt,Very common and ordinary,The plant was as common as dirt and could be found everywhere.,4 class
149,As cool as ice,Very cool and composed,The athlete was as cool as ice under pressure and won the race.,4 class
150,As crazy as a loon,Very crazy and irrational,The person was as crazy as a loon and made no sense.,4 class
151,As crooked as a snake,Very dishonest and deceptive,The salesman was as crooked as a snake and tried to sell her a faulty product.,4 class
152,As cute as a kitten,Very cute and charming,The kitten was as cute as a kitten and everyone wanted to pet her.,4 class
153,As cute as a cupcake,Very cute and sweet,The baby was as cute as a cupcake in her little outfit.,4 class
154,As dark as night,Very dark and black,The room was as dark as night and she couldn't see anything.,4 class
155,As dead as a doornail,Completely dead and lifeless,The plant was as dead as a doornail and couldn't be revived.,4 class
156,As deaf as a post,Completely deaf and unable to hear,The old man was as deaf as a post and needed a hearing aid.,4 class
157,As deep as the ocean,Very deep and profound,The poem was as deep as the ocean and had many layers of meaning.,4 class
158,As different as night and day,Completely different,The two brothers were as different as night and day in their personalities.,4 class
159,As difficult as climbing a mountain,Very difficult and challenging,The test was as difficult as climbing a mountain and she struggled to pass.,4 class
160,As dry as a bone,Very dry and arid,The desert was as dry as a bone and had no water source.,4 class
161,As dumb as a rock,Very stupid and unintelligent,The student was as dumb as a rock and struggled in school.,4 class
162,As easy as falling off a log,Very easy and simple,The project was as easy as falling off a log and she finished it quickly.,4 class
163,As easy as pie,Very easy and simple,The math problem was as easy as pie and she solved it in no time.,4 class
164,As excited as a kid on Christmas morning,Very excited and enthusiastic,The children were as excited as kids on Christmas morning to go on the field trip.,4 class
165,As flat as a pancake,Very flat and even,The road was as flat as a pancake and made for a smooth bike ride.,4 class
166,As free as a bird,Very free and unencumbered,She felt as free as a bird when she finally finished her exams.,4 class
167,As fresh as a daisy,Very fresh and new,The flowers were as fresh as a daisy and smelled wonderful.,4 class
168,As funny as a clown,Very funny and amusing,The comedian was as funny as a clown and had everyone laughing.,4 class
169,As gentle as a lamb,Very gentle and kind,The new teacher was as gentle as a lamb and the students loved her.,4 class
170,As neat as a pin,Very tidy and organized,"Her room was as neat as a pin, with everything in its place.",4 class
171,As nervous as a cat,Very nervous and anxious,The performer was as nervous as a cat before going on stage.,4 class
172,As noisy as a bee,Very noisy and busy,The classroom was as noisy as a bee hive during group work time.,4 class
173,As numb as a log,Completely numb and unfeeling,"After sitting on her foot for too long, her leg was as numb as a log.",4 class
174,As nutty as a fruitcake,Very crazy and eccentric,"The artist was as nutty as a fruitcake, creating bizarre sculptures.",4 class
175,As nimble as a deer,Very agile and quick,"The athlete was as nimble as a deer, easily jumping over obstacles.",4 class
176,As nasty as a snake,Very mean and unpleasant,"The bully was as nasty as a snake, constantly picking on others.",4 class
