id,word,word_definition,antonyms,synonyms,example,relevance
3255,Yoke,A wooden bar that joins two animals together for plowing,"Separate, disconnect, detach, release","Harness, coupling, link, bond",The oxen were joined together by a heavy yoke.,5 class
3256,Yonder,Over there or in the distance,"Here, nearby, close, immediate","Over there, afar, faraway, remote",The mountains yonder looked majestic in the sunset.,5 class
3257,Yearly,Occurring or done once a year,"Daily, weekly, monthly, hourly","Annual, yearly, yearly, once-a-year",The company holds a yearly meeting to discuss its finances.,5 class
3258,Yacht,"A large, luxurious boat used for pleasure","Dinghy, canoe, kayak, rowboat","Boat, vessel, ship, cruiser",The millionaire sailed his yacht around the world.,5 class
3259,Yell,To shout or scream loudly,"Whisper, murmur, mumble, talk","Shout, scream, bellow, holler",The coach yelled at the players to run faster.,5 class
3260,Yellow,A color between green and orange on the spectrum,"Blue, green, purple, pink","Gold, amber, saffron, lemon",The fields were covered in yellow daffodils.,5 class
3261,Yawn,To open the mouth wide and inhale deeply,"Close, shut, pucker, purse","Gape, open wide, inhale, exhale",She yawned and rubbed her tired eyes.,5 class
3262,Yodeler,Someone who sings with a distinctive high-pitched voice,"Dancer, musician, actor, athlete","Singer, vocalist, crooner, performer",The yodeler's performance was a hit with the audience.,5 class
3263,Yesterday,The day before today,"Today, tomorrow, future, upcoming","Past, previous, last, former",She reminisced about the events of yesterday.,5 class
3264,Yearbook,A book published annually that contains information about a school or organization,"Daily, weekly, monthly, sporadic","Annual, publication, yearbook, souvenir",The yearbook featured photos of all the graduating seniors.,5 class
3265,Yokefellow,A companion or partner,"Enemy, opponent, rival, foe","Partner, companion, ally, friend",He considered his wife to be his closest yokefellow.,5 class
3266,Yummy,Delicious or tasty,"Disgusting, unappetizing, unpalatable, unpleasant","Delicious, tasty, appetizing, delectable","The chocolate cake was so yummy,",5 class
3267,And,Connecting two or more items or thoughts,"Or, but, yet, however","Plus, also, as well, in addition",She likes pizza and pasta.,5 class
3268,But,Contrasting two items or thoughts,"And, also, in addition, furthermore","Yet, however, although, nevertheless","She wants to go to the party, but she has to finish her homework.",5 class
3269,Or,Expressing a choice between two items or thoughts,"And, both, neither, nor","Either, alternatively, otherwise, rather",Do you want pizza or pasta for dinner?,5 class
3270,So,Expressing the consequence of something,"But, however, although, nevertheless","Consequently, hence, therefore, thus","She studied hard, so she passed the exam.",5 class
3271,Yet,Expressing something that is unexpected or contrary to expectation,"And, also, in addition, furthermore","However, nevertheless, still, though","She studied hard, yet she failed the exam.",5 class
3272,Because,Expressing the reason for something,"Although, despite, nevertheless, yet","Since, as, due to, owing to",She couldn't come to the party because she was sick.,5 class
3273,Although,Expressing a contrast between two items or thoughts,"And, also, in addition, furthermore","Even though, though, despite, notwithstanding","Although it was raining, she decided to go for a walk.",5 class
3274,Since,Expressing the starting point of something,"Although, despite, nevertheless, yet","As, because, for, given that","Since it's your birthday, let's celebrate!",5 class
3275,If,Expressing a hypothetical or conditional situation,"Or, but, yet, however","Whether, provided, assuming, supposing","If it rains, we will stay indoors.",5 class
3276,Unless,Expressing a negative condition,"And, also, in addition, furthermore","Except, if not, except if, without",You won't pass the exam unless you study.,5 class
3277,While,Expressing a contrast or comparison between two items or thoughts,"And, also, in addition, furthermore","Whereas, although, though, even though","While she likes chocolate, her sister prefers vanilla.",5 class
3278,Whether,Expressing a choice between two alternatives,"And, also, in addition, furthermore","If, either, or, neither",I don't know whether I want pizza or pasta for dinner.,5 class
3279,Even though,Expressing a contrast between two items or thoughts,"And, also, in addition, furthermore","Although, though, despite, notwithstanding","Even though it was late, she decided to finish her work.",5 class
3280,As soon as,Expressing the point in time when something will happen,"Before, until, unless, without","When, once, immediately, directly",I'll call you as soon as I arrive.,5 class
3281,Before,Expressing the point in time prior to something else,"After, since, once, when","Prior to, earlier, previously, beforehand",I'll finish my work before I go to bed.,5 class
3282,After,Expressing the point in time subsequent to something else,"Before, since, once, when","Subsequent to, following, later, afterwards",I'll watch a movie after I finish my work.,5 class
3283,Because of,Expressing the reason for something,"Despite, although, nevertheless, yet","Due to, owing to, on account of, as a result of",She couldn't come to the party because of her work.,5 class
3284,Eat,Consume food or drink,"Abstain, fast, starve, reject","Devour, ingest, munch, consume",I eat breakfast every morning.,5 class
3285,Run,Move quickly on foot,"Walk, crawl, saunter, stroll","Sprint, jog, dash, hasten",I run in the park every day.,5 class
3286,Read,Look at and comprehend the meaning of written or printed matter,"Misread, overlook, disregard, ignore","Study, peruse, skim, glance",She likes to read books before going to bed.,5 class
3287,Write,Mark letters or words on a surface with a pen or pencil,"Erase, delete, cancel, cross out","Compose, jot, record, inscribe",I write in my journal every night.,5 class
3288,Sing,Produce musical sounds with the voice,"Whisper, mumble, speak, shout","Chant, croon, hum, vocalize",She loves to sing in the shower.,5 class
3289,Dance,Move rhythmically to music,"Stumble, falter, trip, shuffle","Waltz, tango, shimmy, twirl",They danced all night at the party.,5 class
3290,Swim,Move through water by propelling oneself with the limbs,"Sink, drown, float, paddle","Dive, paddle, breaststroke, backstroke",She learned how to swim at a young age.,5 class
1,Happy,Feeling or showing pleasure or contentment.,"Sad, unhappy, miserable, sorrowful","Joyful, delighted, glad, cheerful",I'm so happy that it's sunny outside and we can go play in the park.,Prep Class
2,Big,"Of considerable size, extent, or intensity.","Small, tiny, little, miniature","Large, huge, massive, gigantic",Look at that big tree! It's so tall and has lots of leaves.,Prep Class
3,Brave,Showing courage or determination in the face of danger or difficulty.,"Cowardly, timid, fearful, scared","Courageous, fearless, bold, heroic",The superhero was very brave and saved the city from the bad guys.,Prep Class
4,Funny,Causing laughter or amusement; comical.,"Serious, unfunny, dull, boring","Humorous, amusing, hilarious, entertaining","The clown at the birthday party was so funny, he made us all laugh.",Prep Class
5,Kind,"Having or showing a friendly, generous, and considerate nature","Cruel, unkind, selfish, mean","Compassionate, caring, helpful, benevolent",The neighbor was very kind and gave us some cookies to share.,Prep Class
6,Fast,Moving or capable of moving at high speed.,"Slow, sluggish, leisurely, gradual","Quick, rapid, swift, speedy","The race car was so fast, it zoomed past all the other cars on the track.",Prep Class
7, Quite,Making little or no noise; not loud or boisterous.,"Noisy, loud, disruptive, chaotic","Silent, peaceful, calm, tranquil","The baby was finally quiet and asleep, so everyone could talk without whispering.",Prep Class
8,Sad,Feeling or showing sorrow; unhappy. ,"Happy, joyful, delighted, content", ,The sad puppy missed its owner and wanted to go home.,Prep Class
9,Loud ,producing or capable of producing a lot of noise,"quiet, silent, hushed, muted","noisy, boisterous, cacophonous, clamorous",The fireworks are so loud!,Prep Class
10,Hot ,having a high temperature,"cold, cool, chilly, frigid","warm, heated, boiling, scorching",The soup is too hot!,Prep Class
11,Bright ,giving out or reflecting a lot of light,"dull, dim, dark, gloomy","radiant, luminous, shining, brilliant",The sun is so bright!,Prep Class
12,Wet ,covered or soaked with water or another liquid,"dry, arid, parched, dehydrated","damp, moist, soggy, drenched",Your clothes are wet!,Prep Class
13,Cold ,having a low temperature,"hot, warm, heated, boiling","chilly, cool, icy, frigid",The ice cream is cold!,Prep Class
14,Dark ,having little or no light,"bright, light, luminous, radiant","dim, murky, gloomy, shadowy",It's dark outside!,Prep Class
184,Apple,"A round fruit with a red, green, or yellow skin and white flesh inside","Orange, Banana, Pear, Pineapple","Fruit, Pippin, Golden Delicious, Granny Smith",I love to eat apples for a snack.,Prep Class
185,Bear,"A large, furry animal with a big body and round ears","Mouse, Rabbit, Squirrel, Chipmunk","Animal, Grizzly, Polar, Panda",We saw a big brown bear at the zoo.,Prep Class
186,Car,A vehicle with four wheels that is used for transportation,"Bike, Scooter, Skateboard, Roller skates","Automobile, Truck, Van, SUV",I want to ride in the car to go to the park.,Prep Class
187,Dog,"A four-legged animal with fur, a wagging tail, and a bark","Cat, Mouse, Bird, Fish","Canine, Pup, Hound, Terrier",Our dog loves to play fetch with his ball.,Prep Class
188,Egg,An oval-shaped object with a hard shell that contains a baby bird or reptile,"Square, Triangle, Circle, Hexagon","Oval, Shell, Yolk, White",We boiled eggs for breakfast this morning.,Prep Class
189,Frog,"A small, slimy animal with a long tongue and webbed feet","Bird, Fish, Mouse, Rabbit","Amphibian, Toad, Bullfrog, Tree frog",We saw a green frog jumping in the pond.,Prep Class
190,Hat,A head covering made of fabric or other materials,"Coat, Shoes, Pants, Shirt","Cap, Beanie, Fedora, Sunhat",I wear a hat to keep the sun out of my eyes.,Prep Class
191,Ice cream,A frozen dessert made from milk or cream and sweet flavorings,"Broccoli, Spinach, Carrots, Brussel sprouts","Dessert, Gelato, Sorbet, Sherbet",I like to eat chocolate ice cream on a hot day.,Prep Class
192,Juice,A drink made from squeezed fruit or vegetables,"Solid, Food, Snack, Meal","Beverage, Nectar, Extract, Pressing",I want to drink orange juice with my breakfast.,Prep Class
193,Kite,A toy that flies in the air when the wind blows,"Car, Train, Boat, Plane","Toy, Paper, Plastic, Diamond",Let's fly a kite in the park on a windy day.,Prep Class
194,Lion,"A large, powerful cat with a golden mane and a roar","Mouse, Rabbit, Squirrel, Chipmunk","Animal, Panther, Tiger, Leopard",We saw a lion at the zoo and it was very loud.,Prep Class
195,Moon,The natural satellite of the Earth that is visible at night,"Sun, Star, Cloud, Sky","Satellite, Orbit, Crescent, Full","Look, there's a full moon in the sky tonight.",Prep Class
196,Nest,A home or shelter built by birds or other animals,"Office, School, Hospital, Store","Home, Shelter, Roost, Den",We found a bird's nest in the tree in our backyard.,Prep Class
197,Orange,A round fruit with a thick skin that is orange in color,"Apple, Banana, Pear, Pineapple","Fruit, Tangerine, Clementine, Mandarin",I want to eat an orange for a snack.,Prep Class
198,Penguin,A flightless bird with a black and white body and a waddle,"Bird, Fish, Mouse, Rabbit","Animal, Emperor, King, Adlie",The penguin is aflightless bird.,Prep Class
199,Name,"A word or phrase that identifies a person, animal, or thing","Anonymous, Unnamed, Unknown, Faceless","Title, Label, Moniker, Nickname",What's your name? My name is Sarah.,Prep Class
200,Nose,The part of the face that sticks out and is used for smelling,"Mouth, Ear, Eye, Chin","Snout, Proboscis, Trunk, Nostril",I sneezed and blew my nose with a tissue.,Prep Class
201,Net,A woven mesh material used for catching or holding objects,"Rope, Cable, Wire, String","Mesh, Web, Grid, Screen",The fish got caught in the fishing net.,Prep Class
202,Nest,A structure made by birds or other animals for their young,"Cage, Trap, Prison, Dungeon","Den, Burrow, Hollow, Cavity",The bird built a cozy nest in the tree.,Prep Class
203,Nut,A hard-shelled seed that can be eaten,"Fruit, Vegetable, Candy, Cake","Seed, Kernel, Acorn, Chestnut",I love to eat almonds and cashews as a snack.,Prep Class
204,Nurse,A person trained to provide medical care and assist doctors,"Patient, Invalid, Cripple, Sufferer","Caregiver, Medic, Practitioner, Attendant",The nurse checked my temperature and gave me medicine.,Prep Class
205,Nail,A hard covering on the tips of fingers and toes,"Skin, Flesh, Muscle, Bone","Claw, Hoof, Talon, Digit",I painted my nails with pink polish.,Prep Class
206,Note,A written or printed message or communication,"Speech, Silence, Quiet, Secret","Memo, Reminder, Memoir, Memo pad",Can you leave a note for me on the fridge?,Prep Class
207,Neck,The part of the body between the head and the shoulders,"Face, Chest, Stomach, Back","Nape, Cervix, Collar, Throat",I wear a necklace around my neck.,Prep Class
208,Night,The period of darkness between sunset and sunrise,"Day, Morning, Afternoon, Sunrise","Darkness, Dusk, Evening, Midnight",I love to read stories before bed at night.,Prep Class
209,Nap,"A short period of sleep, usually during the day","Wakefulness, Alertness, Energy, Vigor","Rest, Siesta, Doze, Snooze",I take a nap after lunch to feel refreshed.,Prep Class
210,Number,A mathematical concept that represents quantity or value,"Letter, Word, Shape, Color","Digit, Figure, Integer, Count",I can count to ten and recognize numbers.,Prep Class
211,Nutmeg,A spice made from the seed of a tropical tree,"Plain, Tasteless, Flavorless, Bland","Spice, Flavoring, Condiment, Seasoning",I love the smell of nutmeg in pumpkin pie.,Prep Class
212,Nurse shark,"A small, harmless shark that lives in shallow waters","Prey, Herbivore, Omnivore, Vegetarian","Shark, Fish, Predator, Carnivore",We saw a nurse shark at the aquarium.,Prep Class
213,Necklace,A piece of jewelry worn around the neck,"Bracelet, Ring, Earring, Anklet","Chain, Choker, Pendant, Collar",I received a beautiful necklace for my birthday.,Prep Class
214,,,,,,Prep Class
215,Sun,The star that provides light and heat to the Earth,"Moon, Cloud, Rain, Snow","Star, Solar, Helios, Sol",The sun is shining brightly in the sky today.,Prep Class
216,Sand,Small grains of rocks or minerals found on beaches and in deserts,"Rock, Pebble, Boulder, Clay","Granules, Gravel, Powder, Dust",I love building sandcastles at the beach.,Prep Class
217,Spider,An eight-legged arachnid that spins webs to catch insects,"Butterfly, Ladybug, Ant, Fly","Arachnid, Tarantula, Daddy Longlegs, Black Widow",Look at the spider spinning its web in the corner.,Prep Class
218,Shoe,"A covering for the foot, usually made of leather or rubber","Sock, Barefoot, Slipper, Flip-flop","Footwear, Sneaker, Boot, Sandal",I need to tie my shoe before we go for a walk.,Prep Class
219,Sheep,"A domesticated mammal with woolly fur, kept for meat, milk, and wool","Wolf, Fox, Coyote, Bear","Lamb, Ram, Ewe, Flock",The sheep are grazing in the field.,Prep Class
220,Sea,A large body of saltwater that covers most of the Earth's surface,"Land, Mountain, River, Pond","Ocean, Gulf, Bay, Lake",We saw dolphins swimming in the sea during our beach vacation.,Prep Class
221,Spoon,A utensil with a small bowl-shaped end and a long handle used for eating,"Fork, Knife, Chopsticks, Tongs","Utensil, Scoop, Ladle, Spatula","Can you pass me a spoon for my cereal, please?",Prep Class
222,Snake,"A long, legless reptile with scales that slithers on the ground","Lizard, Turtle, Frog, Mouse","Reptile, Serpent, Python, Cobra",We saw a snake in the garden yesterday.,Prep Class
223,Star,"A luminous point in the sky at night, usually a distant sun","Cloud, Sun, Moon, Planet","Celestial body, Constellation, Meteor, Comet",Look at all the stars in the sky tonight.,Prep Class
224,Shirt,A garment with sleeves and buttons that covers the upper body,"Pants, Skirt, Shorts, Socks","Blouse, T-shirt, Polo, Dress shirt",I like wearing my favorite shirt to school.,Prep Class
225,Soccer,A sport played with a ball and two teams trying to score goals,"Basketball, Baseball, Volleyball, Tennis","Football, Futbol, Kickball, Futsal",I scored a goal in soccer practice today.,Prep Class
226,Spoonful,"The amount of a substance that a spoon can hold, usually a small amount","Cupful, Bowlful, Plateful, Bucketful","Serving, Portion, Dollop, Scoop","Can I have a spoonful of ice cream, please?",Prep Class
227,Swim,To move through water by propelling oneself with the arms and legs,"Walk, Run, Jump, Climb","Splash, Dive, Float, Paddle",I learned how to swim at the pool this summer.,Prep Class
228,Sock,"A garment worn on the foot and ankle, usually made of cotton or wool","Shoe, Sandal, Flip-flop, Slipper","Hosiery, Stocking, Footie, Ankle sock",I need to find a matching pair of socks for my shoes.,Prep Class
229,Umbrella,A device used to protect from rain or sun,"Raincoat, Poncho, Hood, Hat","Parasol, Sunshade, Brolly, Canopy",We need to bring an umbrella in case it rains.,Prep Class
230,Uncle,The brother of one's parent,"Father, Mother, Brother, Sister","Aunt, Nephew, Niece, Cousin",My uncle always brings me toys when he visits.,Prep Class
231,Uniform,A set of clothing worn by members of a group or organization,"Casual wear, Non-uniform, Unmatched, Mismatched","Outfit, Dress, Garb, Costume",The school uniform includes a white shirt and navy pants.,Prep Class
232,Up,Toward a higher position or level,"Down, Low, Under, Below","Skyward, Aloft, Heavenward, Upward",The balloons went up into the sky.,Prep Class
233,USA,The abbreviation for the United States of America,"Canada, Mexico, Europe, Asia","America, US, United States, USA","The USA has 50 states and a capital in Washington, D.C.",Prep Class
234,Under,Beneath or below something else,"Above, Over, On top, Up","Below, Beneath, Lower, Bottom",The cat is hiding under the bed.,Prep Class
235,Universe,"All existing matter and space, including all galaxies and stars","Earth, Sun, Moon, Solar System","Cosmos, Space, Creation, Existence",The universe is vast and full of mysteries.,Prep Class
236,Unicycle,A one-wheeled vehicle with pedals and a seat,"Bicycle, Tricycle, Quadricycle, Motorcycle","Monocycle, Wheel, Cycle, Bike",I saw a clown riding a unicycle in the circus.,Prep Class
237,Urge,A strong desire or impulse to do something,"Disinterest, Apathy, Indifference, Neglect","Impulse, Instinct, Drive, Craving",I have an urge to jump in the puddles after it rains.,Prep Class
238,Use,To employ something for a particular purpose,"Misuse, Abuse, Squander, Waste","Employ, Utilize, Apply, Employ",Can I use your pencil to draw a picture?,Prep Class
239,Unicorn,A mythical creature with a single horn on its forehead,"Rhinoceros, Horse, Donkey, Zebra","Alicorn, Pegasus, Horned horse, Magical horse",I wish I could ride a unicorn to the clouds.,Prep Class
240,Upset,"Feeling sad, angry, or unhappy","Happy, Joyful, Content, Delighted","Distressed, Troubled, Sad, Unhappy",I was upset when I lost my favorite toy.,Prep Class
241,Urn,A container with a lid used for holding ashes of the dead,"Coffin, Casket, Tomb, Grave","Vase, Jar, Crock, Pot",We put flowers in the urn to honor my grandfather.,Prep Class
242,Utensil,A tool used for cooking or eating food,"Dish, Plate, Cup, Bowl","Kitchenware, Cookware, Tool, Implement",Can you pass me a utensil to stir the soup?,Prep Class
243,Jump,To propel oneself upwards or forwards,"Still, stay, idle","Leap, bound, hop",The frog likes to jump over the pond.,Prep Class
244,Jelly,"A sweet, semi-solid food","Solid, hard, rigid","Jam, marmalade, preserve",I like to put jelly on my toast.,Prep Class
245,Joy,A feeling of great happiness,"Misery, sadness, sorrow","Delight, bliss, elation",I feel joy when I see my best friend.,Prep Class
246,Jacket,A garment for the upper body,"Shirt, sweater, blouse","Coat, blazer, cardigan",I wear my jacket when it's cold outside.,Prep Class
247,Joke,Something said or done to make others laugh,"Seriousness, solemnity, gravity","Jest, prank, quip",My dad likes to tell jokes at dinner.,Prep Class
248,Juice,A liquid extracted from fruits or vegetables,"Solid, food, dry","Nectar, sap, water",I like to drink orange juice with breakfast.,Prep Class
249,Juggle,"To manipulate objects skillfully, especially in the air","Drop, miss, lose","Balance, toss, spin",The circus performer can juggle five balls at once.,Prep Class
250,Jumping,Moving by jumping repeatedly,"Standing, still, stationary","Bouncing, leaping, hopping",The kids are jumping rope on the playground.,Prep Class
251,Jingle,"A short tune or song, typically used in advertising","Silence, quiet, stillness","Chime, clang, bell",The jingle for the new toy is catchy.,Prep Class
252,Join,To connect or link two or more things together,"Separate, disconnect, disjoin","Unite, combine, attach",Can you join these two puzzle pieces together?,Prep Class
253,Jigsaw,A puzzle consisting of small irregular pieces that are to be fitted together,"Solution, answer, explanation","Puzzle, game, riddle",We are working on a jigsaw puzzle at home.,Prep Class
254,Jellyfish,"A sea creature with a soft, jelly-like body and long tentacles","Predator, hunter, aggressor","Medusa, sea nettle, stinger",We saw a jellyfish at the aquarium.,Prep Class
255,Jolt,"A sudden, violent movement or shock","Smooth, calm, still","Shake, jar, bump",The car ride was bumpy and jolted us around.,Prep Class
256,Jet,A fast-moving stream of liquid or gas,"Drip, drizzle, ooze","Stream, spray, spurt",The water from the hose came out in a jet.,Prep Class
257,Jolly,"Merry, cheerful, and lively","Sad, unhappy, gloomy","Joyful, gleeful, happy",Santa Claus has a jolly laugh.,Prep Class
258,Jungle,A dense forest in a tropical region,"Clearing, plain, meadow","Rainforest, wilderness, thicket",The animals in the jungle are wild and exotic.,Prep Class
259,Jam,A sweet spread made from cooked fruit and sugar,"Dry, solid, hard","Jelly, marmalade, preserve",I like to put jam on my toast.,Prep Class
260,Jacket potato,A potato that is baked whole and served with a variety of toppings,"Uncooked potato, french fries, potato chips","Baked potato, spud, tater",We are having jacket potatoes for dinner tonight.,Prep Class
261,January,The first month of the year,"End, finish, completion","New Year, beginning, start",My birthday is in January.,Prep Class
1007,Water,"A clear, colorless liquid that is essential for life.","Solid, Ice, Steam, Vapor","H2O, Aqua, Fluid, Beverage",I drink water when I'm thirsty.,Prep Class
1008,Whale,A large marine mammal that breathes air through a blowhole on the top of its head.,"Minnow, Shrimp, Plankton, Krill","Cetacean, Leviathan, Mammal, Sea creature",The whale swam gracefully through the ocean.,Prep Class
1009,Wind,The movement of air caused by differences in atmospheric pressure.,"Calm, Stillness, Quiet, Serenity","Breeze, Gust, Draft, Airflow",The wind blew the leaves off the tree.,Prep Class
1010,Wolf,A carnivorous mammal that lives and hunts in packs.,"Sheep, Lamb, Goat, Cow","Canine, Coyote, Jackal, Hyena",The wolf howled at the moon.,Prep Class
1011,Winter,"The coldest season of the year, between autumn and spring.","Summer, Spring, Autumn, Warm","Cold, Frosty, Snowy, Icy",I love to play in the snow in winter.,Prep Class
1012,Watch,A small timepiece worn on the wrist or carried in a pocket.,"Unwatched, Ignore, Neglect, Abandon","Timepiece, Clock, Wristwatch, Stopwatch",I always wear a watch to school.,Prep Class
1013,Watermelon,"A large, juicy fruit with a hard green rind and sweet red flesh.","Dry, Dehydrated, Thirsty, Parched","Melon, Fruit, Refreshing, Juicy",I like to eat watermelon on a hot day.,Prep Class
1014,Worm,"A long, slender, soft-bodied invertebrate animal that burrows in the ground.","Mammal, Bird, Reptile, Fish","Invertebrate, Larva, Crawler, Creepy-crawly",I found a worm in the garden.,Prep Class
1015,Wagon,"A vehicle with four wheels, used for carrying goods or passengers.","Sports car, Convertible, Motorcycle, Bicycle","Cart, Carriage, Trolley, Truck",The pioneers traveled west in covered wagons.,Prep Class
1016,Whistle,"A small, high-pitched musical instrument blown by the mouth to produce a sound.","Silence, Quiet, Mute, Hush","Flute, Pipe, Recorder, Horn",I blew the whistle to start the game.,Prep Class
1017,Walnut,"A nut that has a hard, round shell and a sweet, edible kernel.","Shell, Husk, Rind, Skin","Nut, Seed, Kernel, Fruit",My mom put walnuts in the banana bread.,Prep Class
1018,Wasp,A flying insect with a narrow waist and a sting.,"Butterfly, Moth, Caterpillar, Larva","Insect, Hornet, Bee, Fly",The wasp buzzed around the picnic table.,Prep Class
1019,Wheel,A circular object that rotates around an axle and is used for transportation.,"Square, Triangle, Rectangle, Polygon","Tire, Rim, Spoke, Hub",The bicycle has two wheels.,Prep Class
1020,Witch,A woman who is believed to have magical powers and practices witchcraft.,"Saint, Angel, Hero, Champion","Sorceress, Enchantress, Hag, Wizard",The witch cackled as she stirred her cauldron.,Prep Class
1021,Pencil,A writing tool with a graphite or colored core and a wooden or plastic casing,"Eraser, Correction fluid, Highlighter","Pen, Marker, Crayon",I use a pencil to write my name on my notebook.,Prep Class
