id,word,word_definition,antonyms,synonyms,example,relevance
401,Narrate,To tell a story or give an account of events,"Conceal, Hide, Suppress, Bury","Relate, Recount, Describe, Chronicle",The student was asked to narrate his summer vacation.,4 class
402,Navigate,To find one's way through a place or situation,"Wander, Stray, Mislead, Confuse","Direct, Guide, Steer, Pilot",The student used a map to navigate the new city.,4 class
403,Numb,Lacking sensation or feeling,"Sensitive, Responsive, Feeling, Emotional","Insensitive, Unresponsive, Paralyzed, Benumbed",The cold weather made the student's fingers numb.,4 class
404,Native,Belonging to a particular place or region,"Foreign, Alien, Non-native, Imported","Indigenous, Local, Original, Inborn",The student learned about the native plants of the area.,4 class
405,Nifty,Very good or clever,"Lousy, Mediocre, Terrible, Poor","Excellent, Amazing, Wonderful, Impressive",The nifty project impressed the teacher and classmates.,4 class
406,Nourish,To provide with food or other substances necessary for growth,"Starve, Deprive, Neglect, Abandon","Feed, Nurture, Sustain, Cherish",The student needed to nourish her body with healthy food.,4 class
407,Eager,Having a strong desire or enthusiasm,"Indifferent, Apathetic, Uninterested, Dispassionate","Excited, Enthusiastic, Keen, Fervent",The children were eager to start their art project.,4 class
408,Earnest,Showing sincere and serious conviction,"Insincere, Frivolous, Joking, Playful","Serious, Sincere, Genuine, Fervent",He gave an earnest apology for his mistake.,4 class
409,Eccentric,Unconventional or slightly strange,"Conventional, Normal, Typical, Regular","Quirky, Unusual, Peculiar, Weird",The eccentric old man collected unusual items.,4 class
410,Ecstatic,Feeling or expressing overwhelming happiness or joy,"Depressed, Miserable, Unhappy, Saddened","Delighted, Overjoyed, Thrilled, Exhilarated",She was ecstatic when she got her birthday present.,4 class
411,Edible,Fit or suitable to be eaten,"Inedible, Poisonous, Indigestible, Toxic","Comestible, Palatable, Nutritious, Delicious",The apples from the tree in our yard are edible.,4 class
412,Educated,"Having knowledge, intelligence or skills acquired by study, training or experience","Ignorant, Uninformed, Unlearned, Untrained","Informed, Knowledgeable, Cultured, Erudite",My teacher is an educated person who knows a lot about history.,4 class
413,Effective,Successful in producing a desired or intended result,"Ineffective, Useless, Impotent, Unsuccessful","Efficient, Productive, Powerful, Efficacious",The medicine was effective in curing her illness.,4 class
414,Efficient,Performing or functioning in the best possible manner with the least waste of time and effort,"Inefficient, Slow, Ineffective, Careless","Productive, Effective, Organized, Skillful",The new washing machine is much more efficient than the old one.,4 class
415,Eminent,"Famous, respected, or important within a particular field or profession","Unknown, Insignificant, Obscure, Unimportant","Distinguished, Prominent, Renowned, Notable",The eminent scientist received a Nobel Prize for his work.,4 class
416,Emphatic,Expressing something forcibly and clearly,"Weak, Indecisive, Ambiguous, Uncertain","Forceful, Strong, Definite, Assertive",She gave an emphatic answer to the question.,4 class
417,Empowered,Giving someone the authority or power to do something,"Restricted, Limited, Disabled, Deprived","Authorized, Enabled, Endowed, Invested",The manager empowered his employees to make decisions on their own.,4 class
418,Encouraging,Giving hope or confidence to someone,"Discouraging, Pessimistic, Negative, Demotivating","Supportive, Optimistic, Positive, Reassuring",The teacher gave an encouraging smile to the student who was struggling.,4 class
419,Endangered,In danger of becoming extinct or threatened with harm or danger,"Protected, Safe, Secure, Unthreatened","Threatened, Imperiled, Vulnerable, At risk",The endangered species needs to be protected from extinction.,4 class
420,Enduring,Continuing or lasting over a long period of time,"Fleeting, Temporary, Ephemeral, Transient","Persevering, Lasting, Durable, Surviving",The enduring friendship between the two boys lasted through many challenges.,4 class
421,Energetic,Having or showing great energy or enthusiasm,"Lethargic, Lazy, Inactive, Weak","Lively, Vigorous, Dynamic, Active",The children were very energetic,4 class
422,Lively,Full of energy and enthusiasm,"Dull, Boring, Lifeless, Inactive","Animated, Vivacious, Energetic, Spirited",The lively music made everyone want to dance.,4 class
423,Loyal,Faithful and devoted to a person or cause,"Disloyal, Unfaithful, Treacherous, Betraying","Devoted, Dedicated, Committed, Faithful",The loyal dog never left his owner's side.,4 class
424,Lazy,Unwilling to work or be active,"Industrious, Hardworking, Productive, Energetic","Inactive, Indolent, Idle, Slothful",He was too lazy to clean his room.,4 class
425,Loving,Feeling or showing love and affection,"Hateful, Malicious, Hostile, Dislike","Affectionate, Caring, Tender, Fond",Her loving grandparents always gave her hugs and kisses.,4 class
426,Logical,Based on reason or sound judgment,"Illogical, Irrational, Incoherent, Absurd","Reasonable, Rational, Coherent, Sane",The teacher used a logical argument to explain the problem.,4 class
427,Longing,A strong desire or yearning,"Satisfied, Content, Fulfilled, Pleased","Craving, Yearning, Desiring, Longing for",She had a longing for adventure and travel.,4 class
428,Lucky,Fortunate or having good luck,"Unlucky, Unfortunate, Jinxed, Cursed","Fortunate, Serendipitous, Lucky, Favored",Winning the lottery was a lucky break for her.,4 class
429,Loud,Making a lot of noise or sound,"Quiet, Soft, Silent, Subdued","Noisy, Boisterous, Blaring, Clamorous",The loud thunder scared the little girl.,4 class
430,Learned,Having acquired knowledge or skill through study or experience,"Uneducated, Ignorant, Uninformed, Illiterate","Educated, Knowledgeable, Erudite, Well-informed",The learned professor was an expert in his field.,4 class
431,Lavish,Expending or giving in great amounts,"Thrifty, Frugal, Modest, Economical","Generous, Extravagant, Sumptuous, Luxurious",She threw a lavish party for her friends.,4 class
432,Lazy,Unwilling to work or be active,"Industrious, Hardworking, Productive, Energetic","Inactive, Indolent, Idle, Slothful",He was too lazy to clean his room.,4 class
433,Lonely,Feeling sad or unhappy because of isolation or lack of companionship,"Social, Connected, Companionship, Together","Alone, Solitary, Isolated, Abandoned",She felt lonely without her best friend.,4 class
434,Lovely,Beautiful or attractive in a pleasing way,"Ugly, Unattractive, Repulsive, Unappealing","Beautiful, Charming, Gorgeous, Delightful",The flowers in the garden were lovely.,4 class
435,Luminous,Radiating or reflecting light; shining,"Dark, Dim, Dull, Gloomy","Bright, Radiant, Glowing, Shimmering",The moon was luminous in the night sky.,4 class
436,Lively,Full of energy and enthusiasm,"Dull, Boring, Lifeless, Inactive","Animated, Vivacious, Energetic, Spirited",The lively music made everyone want to dance.,4 class
437,Lucky,Fortunate or having good luck,"Unlucky, Unfortunate, Jinxed, Cursed","Fortunate, Serendipitous, Lucky, Favored",Winning the lottery is considered lucky.,4 class
438,Kind,Having a gentle and friendly nature,"Cruel, Unkind, Harsh, Mean","Compassionate, Caring, Benevolent, Generous",The kind student always helps others who are in need.,4 class
439,Knowledge,"Information, skills, or awareness gained through education","Ignorance, Stupidity, Naivety, Dullness","Understanding, Wisdom, Expertise, Learning",The student gained a lot of knowledge from reading books.,4 class
440,Keen,Having or showing eagerness or enthusiasm,"Apathetic, Indifferent, Cool, Lukewarm","Enthusiastic, Excited, Fervent, Ardent",The keen student was excited to learn about the new topic.,4 class
441,Keep,To have or retain possession of something,"Give away, Lose, Dispose, Release","Hold, Retain, Preserve, Save",The student needs to keep their backpack organized.,4 class
442,Keyboard,An electronic device with keys used for typing or playing music,"Mouse, Touchpad, Stylus, Joystick","Typewriter, Piano, Synthesizer, Organ",The student learned how to play the keyboard in music class.,4 class
443,Kid,A child,"Adult, Senior, Elderly, Grown-up","Youngster, Youth, Child, Infant",The kid was excited to go to the playground after school.,4 class
444,Kindness,"The quality of being friendly, generous, and considerate","Cruelty, Meanness, Hatred, Hostility","Benevolence, Compassion, Warmth, Sympathy",The student showed kindness by helping a classmate in need.,4 class
445,King,A male ruler of a kingdom or empire,"Commoner, Peasant, Servant, Subject","Monarch, Emperor, Sultan, Prince",The student learned about King Henry VIII in history class.,4 class
446,Kitchen,A room or area where food is prepared and cooked,"Bathroom, Bedroom, Living room, Office","Cookhouse, Galley, Scullery, Pantry",The student's mother cooked dinner in the kitchen.,4 class
447,Kick,To strike with the foot,"Hold, Grasp, Embrace, Clasp","Strike, Boot, Punt, Thrust",The student kicked the ball during recess.,4 class
448,Knack,A natural skill or talent for doing something,"Inability, Incapacity, Disadvantage, Flaw","Aptitude, Gift, Talent, Flair",The student had a knack for solving puzzles.,4 class
449,Knowledgeable,Having a lot of knowledge or information on a particular subject,"Ignorant, Uninformed, Naive, Uneducated","Informed, Expert, Educated, Learned",The knowledgeable student gave a presentation on marine life.,4 class
450,Key,A small metal instrument used to open a lock or operate a device,"Barrier, Obstacle, Impediment, Hindrance","Lock, Clue, Solution, Secret",The student found the key to the locked classroom.,4 class
451,Observe,To watch or notice something carefully,"Ignore, Neglect, Disregard, Overlook","Monitor, Watch, View, Examine",The student likes to observe the birds in the park.,4 class
452,Occupation,A person's job or profession,"Unemployment, Idleness, Leisure, Hobby","Career, Vocation, Trade, Employment",The student's father's occupation is a doctor.,4 class
453,Offend,To cause someone to feel upset or angry,"Please, Praise, Delight, Flatter","Insult, Upset, Hurt, Displease",The student did not mean to offend his friend.,4 class
454,Offer,To present something for someone to accept or reject,"Refuse, Deny, Reject, Decline","Provide, Supply, Give, Offer up",The student offered to share his snack with his friend.,4 class
455,Opinion,A belief or judgment about something,"Fact, Reality, Truth, Certainty","View, Perspective, Sentiment, Attitude",The student shared his opinion on the topic during class.,4 class
456,Opportunity,A chance or occasion to do something,"Obstacle, Hurdle, Barrier, Challenge","Chance, Occasion, Possibility, Window",The student had the opportunity to go on a field trip.,4 class
457,Order,A request or instruction to do something in a particular way,"Disorder, Chaos, Confusion, Anarchy","Command, Directive, Decree, Injunction",The student followed the teacher's order to be quiet.,4 class
458,Organize,To arrange or put things in order,"Disorganize, Mess up, Scatter, Confuse","Systematize, Structure, Arrange, Classify",The student learned how to organize his desk.,4 class
459,Original,Being the first of its kind or not copied from something else,"Repetitive, Unoriginal, Copycat, Imitative","Creative, Innovative, Unique, Fresh",The student wrote an original story for the class project.,4 class
460,Outfit,A set of clothes worn together,"Disrobe, Undress, Bare, Strip","Ensemble, Attire, Garb, Costume",The student wore a new outfit on the first day of school.,4 class
461,Outside,Located or occurring beyond the boundaries of a building,"Interior, Indoor, Internal, Enclosed","Exterior, Outdoor, External, Open-air",The student likes to play outside during recess.,4 class
462,Overcome,To defeat or prevail over something that was difficult,"Surrender, Give up, Yield, Submit","Conquer, Vanquish, Overpower, Subdue",The student worked hard to overcome his fear of public speaking.,4 class
463,Overjoyed,Extremely happy or delighted,"Displeased, Unhappy, Miserable, Depressed","Ecstatic, Thrilled, Elated, Delighted",The student was overjoyed to receive an A on the test.,4 class
1245,Wisdom,"The quality of having experience, knowledge, and good judgment","Foolishness, Stupidity, Ignorance, Naivety","Insight, Understanding, Sagacity, Prudence",The student's grandmother has a lot of wisdom to share.,4 class
1246,Windy,Having a lot of wind; characterized by or exposed to strong winds,"Calm, Still, Windless, Stagnant","Blustery, Gusty, Stormy, Breezy",The student's kite flew high on a windy day.,4 class
1247,Whale,"A very large marine mammal with a streamlined hairless body, a horizontal tail fin, and a blowhole on top of the head for breathing",None,"Orca, Humpback, Sperm, Beluga",The student saw a whale during a trip to the ocean.,4 class
1248,Wobble,To move unsteadily from side to side; to have an unsteady or unsure movement or gait,"Steady, Stable, Fixed, Firm","Teeter, Totter, Rock, Sway",The student's bike wobbled as they rode down the hill.,4 class
1249,Wallet,"A small, flat folding case for carrying money and other small personal items",None,"Purse, Billfold, Clutch, Pouch",The student kept their allowance in their wallet.,4 class
1250,Wonderful,"Inspiring delight, pleasure, or admiration; extremely good; marvelous","Terrible, Awful, Horrible, Dreadful","Amazing, Fantastic, Incredible, Phenomenal",The student had a wonderful time at the amusement park.,4 class
1251,Warm,"Having or giving off a moderate degree of heat; having a feeling of warmth; showing enthusiasm, affection, or kindness","Cold, Chilly, Cool, Frigid","Mild, Balmy, Toasty, Tepid",The student felt warm and cozy by the fireplace.,4 class
1252,Watch,A small timepiece worn on the wrist or carried in a pocket,None,"Timepiece, Chronometer, Stopwatch, Clock",The student checked their watch to make sure they weren't late.,4 class
1253,Whisper,To speak very softly or quietly,"Shout, Yell, Scream, Roar","Murmur, Mumble, Hush, Speak Under One's Breath",The student whispered a secret to their friend.,4 class
1254,Winter,"The coldest season of the year, occurring between autumn and spring","Summer, Spring, Fall, Autumn","Snowy, Icy, Frosty, Chilly",The student loves playing in the snow during winter.,4 class
1255,Wipe,"To clean or dry (something) by rubbing its surface with a cloth, a piece of paper, or one's hand","Smear, Dirty, Smudge, Soil","Clean, Dry, Rub, Polish",The student wiped the table clean after finishing their snack.,4 class
1256,Wonder,"A feeling of surprise and admiration caused by something beautiful, unexpected, or inexplicable","Boredom, Apathy, Indifference, Mundanity","Amazement, Astonishment, Miracle, Phenomenon",The student wondered how the stars in the sky stayed in place.,4 class
1257,Water,"A clear, colorless, odorless, and tasteless liquid that is essential for most forms of life","Dryness, Aridity, Dehydration, Parchedness","H2O, Aqua, Fluid, Moisture",The student drank water to stay hydrated during their soccer game.,4 class
1258,Vehicle,A machine used for transportation,"Pedestrian, Foot","Car, Truck, Bus, Bike",The student's family took a vehicle to go on a road trip.,4 class
1259,Valley,A low area of land between hills or mountains,"Peak, Summit, Mountain, Cliff","Canyon, Ravine, Glen, Dell",The student's town is located in a valley surrounded by hills.,4 class
1260,Vanilla,A flavoring extracted from the vanilla bean or produced artificially,"Exotic, Spicy, Flavored, Complex","Plain, Classic, Natural, Simple",The student ordered a vanilla ice cream cone.,4 class
1261,Vacation,"A period of time devoted to pleasure, rest, or relaxation away from work or school","Work, School, Duty, Responsibility","Holiday, Break, Getaway, Leave",The student went on vacation to the beach with their family.,4 class
1262,Visit,To go or come to see (someone) for a short time,"Avoid, Shun, Ignore, Neglect","Call on, Drop in, Stop by, See",The student went to visit their grandparents for the weekend.,4 class
1263,Vegetable,A plant or part of a plant used as food,"Meat, Dairy, Fruit, Junk food","Broccoli, Carrot, Peas, Spinach",The student's favorite vegetable is broccoli.,4 class
1264,Volunteer,A person who freely offers to do something,"Recipient, Taker, Demander, Beggar","Helper, Contributor, Donor, Philanthropist",The student decided to volunteer at the animal shelter.,4 class
1265,Video,"A recording of moving visual images, especially one intended for broadcast","Audio, Sound, Music, Voice","Film, Movie, Clip, Footage",The student watched a funny video on their computer.,4 class
1266,Victory,A success or triumph over an enemy or opponent,"Loss, Defeat, Failure, Surrender","Win, Conquest, Success, Triumph",The student's soccer team celebrated their victory with a pizza party.,4 class
1267,Village,A small community in a rural area,"City, Metropolis, Urban area, Megalopolis","Hamlet, Town, Settlement, Community",The student visited a village in the countryside during a field trip.,4 class
1268,Voice,"The sound produced in a person's larynx and uttered through the mouth, as speech or song","Silence, Muteness, Hush, Quiet","Tone, Pitch, Sound, Timbre",The student raised their voice to ask a question during class.,4 class
1269,Violet,A bluish-purple color,"Yellow, Orange, Red, Green","Lavender, Lilac, Plum, Amethyst",The student colored a violet flower in their art class.,4 class
1270,Value,The worth or usefulness of something,"Worthlessness, Uselessness, Meaninglessness, Insignificance","Importance, Worth, Benefit, Significance",The student learned the value of saving money.,4 class
1271,Vacation,"A period of time devoted to pleasure, rest, or relaxation away from work or school","Work, School, Duty, Responsibility","Holiday, Break, Getaway, Leave",The student went on vacation to the beach with their family.,4 class
1272,Venus,The second planet from the sun in our solar system; also the Roman goddess of love and beauty,None,None,The student learned about the planet Venus in their science class.,4 class
1273,Diligent,Hardworking and persistent,"Lazy, idle, slothful, negligent","Hardworking, industrious, assiduous, conscientious",The student was diligent in completing their homework every day.,4 class
1274,Decisive,Able to make quick and firm decisions,"Indecisive, hesitant, unsure, wavering","Resolute, determined, unwavering, decisive",The student was decisive and quickly chose the correct answer.,4 class
1275,Dependable,Reliable and trustworthy,"Unreliable, untrustworthy, undependable, irresponsible","Reliable, trustworthy, dependable, responsible",The student was dependable and always turned in their assignments on time.,4 class
1276,Dedicated,Devoted to a task or cause,"Uncommitted, unfaithful, disloyal, apathetic","Committed, devoted, loyal, dedicated",The student was dedicated to improving their grades.,4 class
1277,Disciplined,Able to control one's behavior,"Uncontrolled, undisciplined, unrestrained, impulsive","Self-controlled, disciplined, restrained, composed",The student was disciplined and did not get distracted during class.,4 class
1278,Diplomatic,Able to handle sensitive situations tactfully,"Blunt, rude, tactless, undiplomatic","Tactful, diplomatic, discreet, polite",The student was diplomatic and able to resolve conflicts peacefully.,4 class
1279,Determined,Strongly motivated to achieve a goal,"Unmotivated, undetermined, indecisive, weak-willed","Motivated, determined, resolved, persistent",The student was determined to become a better reader.,4 class
1280,Diligence,Careful and persistent effort,"Laziness, idleness, sloth, negligence","Perseverance, persistence, hard work, diligence",The student's diligence paid off with improved grades.,4 class
1281,Detail-oriented,Focused on small details,"Careless, sloppy, imprecise, inattentive","Meticulous, thorough, precise, detail-oriented",The student was detail-oriented and caught mistakes in their work.,4 class
1282,Dynamic,Energetic and enthusiastic,"Dull, lethargic, apathetic, static","Energetic, enthusiastic, lively, dynamic",The student was dynamic and participated actively in class.,4 class
1283,Decent,Respectable and appropriate,"Disrespectful, inappropriate, indecent, improper","Respectable, appropriate, decent, proper",The student's behavior was always decent and respectful.,4 class
1284,Deliberate,Intentional and carefully thought out,"Accidental, unintentional, haphazard, impulsive","Intentional, deliberate, purposeful, calculated",The student's deliberate approach to problem-solving was effective.,4 class
1285,Direction,Guidance or instruction,"Misdirection, confusion, misguidance, misinformation","Guidance, instruction, direction, advice",The student needed direction on how to complete the assignment.,4 class
1286,Develop,To grow or progress over time,"Stagnate, regress, decline, deteriorate","Grow, progress, develop, advance",The student was able to develop their writing skills with practice.,4 class
1287,Diversity,A range of different things or people,"Uniformity, sameness, homogeneity, conformity","Variety, diversity, assortment, range",The student appreciated the diversity of their classmates' cultures.,4 class
1288,Dialogue,Conversation or discussion,"Monologue, soliloquy, lecture, sermon","Conversation, discussion, dialogue, exchange",The student participated in the dialogue during the class debate.,4 class
1289,Yellow,A color resembling the yolk of an egg,"Purple, Blue, Green, Red","Lemon, Gold, Amber, Mustard",The student colored a sunflower with yellow petals.,4 class
1290,Year,"A period of 365 days, divided into 12 months","Day, Hour, Minute, Second","Twelve months, Annual, Calendar year, Fiscal year",The student celebrated their birthday every year.,4 class
1291,Yesterday,The day before today,"Today, Tomorrow, Future, Next day","Prior day, Last day, Recent past, Formerly",The student forgot their homework yesterday.,4 class
1292,Yoga,A Hindu discipline aimed at achieving a state of perfect spiritual insight and tranquility,"Stress, Tension, Anxiety, Worry","Meditation, Contemplation, Mindfulness, Breathing",The student practiced yoga to relax after school.,4 class
1293,Yawn,To open one's mouth wide and inhale deeply due to tiredness or boredom,"Close, Shut, Grin, Smile","Gape, Inhale, Sigh, Puff",The student couldn't stop yawning during the boring lecture.,4 class
1294,Yearn,To have an intense longing or desire,"Dislike, Hate, Loathe, Despise","Crave, Long, Desire, Hunger",The student yearned to go on a trip to Disney World.,4 class
1295,Yacht,A medium-sized sailing boat equipped for cruising or racing,"Canoe, Raft, Kayak, Paddleboat","Cruiser, Sailboat, Vessel, Ship",The student's parents went on a yacht cruise for their anniversary.,4 class
1296,Yellow,A color resembling the yolk of an egg,"Purple, Blue, Green, Red","Lemon, Gold, Amber, Mustard",The student colored a sunflower with yellow petals.,4 class
1297,Yolk,The yellow part of an egg,None,None,The student cooked scrambled eggs with the yolk included.,4 class
1298,Youth,The period between childhood and adult age,"Adulthood, Maturity, Seniority, Old age","Adolescence, Puberty, Youngness, Immaturity",The student enjoyed playing sports during their youth.,4 class
1299,Yearly,Occurring or done once a year,"Weekly, Monthly, Daily, Hourly","Annual, Yearlong, Regular, Repeating",The student's school had a yearly field day.,4 class
1300,Yell,To shout loudly and angrily,"Whisper, Mutter, Murmur, Speak softly","Scream, Shout, Roar, Bellow",The student's coach yelled at them during practice.,4 class
1301,Yield,"To produce or provide a natural, industrial, or economic product or result","Refuse, Deny, Withhold, Resist","Generate, Provide, Return, Produce",The student's garden yielded a lot of tomatoes this year.,4 class
1302,Yarn,"A long, continuous length of fibers used for knitting or weaving","Cord, Rope, Cable, Wire","Thread, Fiber, Strand, Twine",The student learned how to knit with yarn in their art class.,4 class
1303,Yes,Used to give an affirmative response or agreement,"No, Never, Not, Refusal","Affirmative, Okay, Alright, Certainly",The student said yes to their friend's invitation to play.,4 class
1304,Tenacious,Holding fast; stubbornly persistent,"Weak, yielding, flexible, surrendering","Stubborn, persistent, determined, unyielding",The student was tenacious in their efforts to solve the math problem.,4 class
1305,Tactful,Having or showing sensitivity in dealing with others,"Inconsiderate, tactless, impolite, rude","Diplomatic, polite, considerate, courteous",The student was tactful in their interactions with classmates.,4 class
1306,Thoughtful,Considerate and attentive to the needs of others,"Inconsiderate, thoughtless, uncaring, selfish","Considerate, attentive, caring, kind",The student was thoughtful and offered to help their friend with homework.,4 class
1307,Timid,Shy or lacking in self-confidence,"Bold, confident, outgoing, assertive","Shy, bashful, introverted, hesitant",The student was too timid to ask the teacher a question.,4 class
1308,Trustworthy,Able to be relied on as honest or truthful,"Unreliable, dishonest, untrustworthy, insincere","Reliable, honest, dependable, sincere",The student was trustworthy and always told the truth.,4 class
1309,Thorough,Complete and with attention to detail,"Superficial, cursory, hasty, careless","Comprehensive, detailed, meticulous, exhaustive",The student did a thorough job on their science project.,4 class
1310,Tenacity,The quality of being persistent and determined,"Weakness, yielding, flexibility, surrendering","Persistence, determination, perseverance, steadfastness",The student's tenacity helped them overcome obstacles.,4 class
