id,word,word_definition,antonyms,synonyms,example,relevance
329,Shark,A large predatory fish with sharp teeth and a streamlined body,"Goldfish, Trout, Salmon, Tuna","Great white shark, Hammerhead, Tiger shark, Bull shark",I learned about sharks in science class today.,2 class
330,Skate,To move on a flat surface with wheels or blades attached to shoes,"Walk, Run, Crawl, Stumble","Roller skate, Ice skate, Skateboard, Longboard",I love to skate at the roller rink with my friends.,2 class
331,Sled,A vehicle used for sliding downhill over snow or ice,"Car, Truck, Motorcycle, Bicycle","Toboggan, Sleigh, Bobsled, Snowmobile",We're going to sled down the hill after it snows.,2 class
332,Seal,"A marine mammal with flippers, a streamlined body, and a thick layer of blubber","Bird, Fish, Mammal, Reptile","Sea lion, Walrus, Otter, Dolphin",I saw a seal at the aquarium last weekend.,2 class
333,Apple,"A round fruit with red, green, or yellow skin and a white inside","Orange, Banana, Pear, Mango","Fruit, Pome, Gala, Granny Smith",I had an apple for a snack today.,2 class
334,Ant,A small six-legged insect that lives in colonies and often carries food back to its nest,"Human, Elephant, Lion, Giraffe","Insect, Formica, Myrmecia, Pheidole",I saw an ant carrying a crumb of bread on the sidewalk.,2 class
335,Airplane,A vehicle with wings and one or more engines that can fly through the air,"Car, Boat, Train, Bus","Aircraft, Plane, Jet, Helicopter",I'm going on an airplane ride to visit my grandparents.,2 class
336,Alphabet,"The set of letters used in a language, arranged in a particular order","Numbers, Symbols, Emojis, Pictures","ABCs, Letters, Writing, Language",I'm learning the alphabet in school this year.,2 class
337,Arrow,"A straight thin stick with a pointed end, used for shooting with a bow","Shield, Armor, Sword, Spear","Dart, Shaft, Quiver, Archery",I drew an arrow pointing to the treasure on the map.,2 class
338,Acorn,"The nut of an oak tree, with a cap and a hard shell","Walnut, Chestnut, Pecan, Pistachio","Nut, Seed, Oak nut, Oak drop",I found an acorn on the ground while hiking in the woods.,2 class
339,Animal,"A living organism that feeds on organic matter, typically having specialized sense organs and nervous system","Plant, Mineral, Rock, Inanimate","Creature, Beast, Critter, Mammal",I love learning about different animals in science class.,2 class
340,Astronaut,A person who travels in space,"Earthling, Terrestrial, Groundling, Mortal","Space traveler, Cosmonaut, Rocketman, Space cadet",I want to be an astronaut when I grow up and explore the universe.,2 class
341,Autumn,"The season between summer and winter, characterized by cooler temperatures and falling leaves","Spring, Summer, Winter, Heat","Fall, Harvest, Crisp, Golden",The leaves on the trees turn orange and yellow in the autumn.,2 class
342,Aurora,"A natural light display in the sky, predominantly seen in high-latitude regions","Darkness, Night, Eclipse, Blackout","Northern lights, Southern lights, Aurora borealis, Aurora australis",I saw a beautiful aurora in the sky on our camping trip.,2 class
343,Alligator,"A large predatory reptile with a broad snout and sharp teeth, found in the southern United States and China","Mouse, Rabbit, Squirrel, Chipmunk","Crocodile, Caiman, Gator, Swamp lizard",I saw an alligator at the zoo last weekend.,2 class
344,Astronomer,A person who studies celestial objects and phenomena,"Uninterested, Disbeliever, Skeptic, Realist","Scientist, stargazer, cosmologist, astrophysicist",My uncle is an astronomer and studies the stars at night.,2 class
345,Aquarium,"A container filled with water and aquatic plants and animals, used for displaying and observing marine life","Zoo, Museum, Park, Garden","Fish tank, Terrarium, Vivarium, Reptile house",We went to the aquarium to see the fish and sharks.,2 class
346,Monkey,A small to medium-sized primate with a long tail and usually fur,"Human, Robot, Machine, Statue","Ape, Gorilla, Chimpanzee, Baboon",I saw a monkey swinging from the trees at the zoo.,2 class
347,Magic,"The art of producing illusions by sleight of hand, sometimes seen as supernatural","Science, Reality, Fact, Truth","Sorcery, Wizardry, Enchantment, Charm",The magician made a rabbit disappear with a magic wand.,2 class
348,Moon,"A natural satellite of Earth, visible in the night sky as a white or yellowish disc","Sun, Star, Planet, Earth","Lunar, Celestial, Satellite, Orbit",I looked up at the moon and saw a full moon tonight.,2 class
349,Music,"The art of sound in time that expresses ideas and emotions in significant forms through the elements of rhythm, melody, harmony, and color","Silence, Noise, Quiet, Stillness","Tune, Song, Melody, Harmony",I love listening to music and singing along with my favorite songs.,2 class
350,Mouse,"A small, typically furry, mammal with a pointed snout and rounded ears","Cat, Dog, Elephant, Giraffe","Rodent, Rat, Hamster, Gerbil",I saw a mouse running across the kitchen floor last night.,2 class
351,Magic Carpet,"A carpet that can fly through the air, often seen in fictional stories","Non-magical carpet, Plain carpet, Dirty carpet, Old carpet","Flying rug, Enchanted carpet, Aladdin's carpet, Genie's carpet",Aladdin flew on a magic carpet with his friends in the story.,2 class
352,Maple,"A tree or shrub with lobed leaves, winged fruits, and colorful autumn foliage","Evergreen, Palm, Cactus, Succulent","Tree, Sap, Leaf, Syrup",The maple leaves turn red and orange in the fall.,2 class
353,Mitten,"A glove with two sections, one for the thumb and the other for the four fingers","Bare hand, Fingerless glove, Arm warmer, Sleeve","Glove, Handwear, Mitt, Fleece",I wore a warm mitten on my hand to play in the snow.,2 class
354,Magic Wand,A stick or rod used by a magician to perform tricks or spells,"Non-magical stick, Regular wand, Branch, Twig","Enchanted wand, Fairy wand, Wizard wand, Harry Potter wand",The magician waved a magic wand and made a rabbit appear.,2 class
355,Marshmallow,"A soft, spongy confection made from sugar and gelatin, often used for roasting over a fire","Vegetable, Meat, Fruit, Cheese","Candy, Sweet, Fluffy, Treat",We roasted marshmallows over the campfire and made s'mores.,2 class
356,Monster,"A large, scary creature often seen in horror movies or books","Hero, Friend, Angel, Fairy","Beast, Ogre, Dragon, Werewolf",The monster under my bed scared me at night.,2 class
357,Moonlight,"Light reflected from the moon, often seen as a soft, silver glow","Sunlight, Daylight, Bright light, Artificial light","Lunar light, Night light, Moonshine, Starlight",The moonlight shone through my window and made a pattern on the floor.,2 class
358,Movie,"A motion picture, often seen in theaters or on a screen","Book, Play, Game, Music","Film, Flick, Cinema, Picture",We went to see a movie and ate popcorn and candy.,2 class
1124,Neat,Clean and orderly,"Messy, untidy, disorganized, sloppy","Tidy, organized, pristine, immaculate",The student's desk was always neat and tidy.,2 class
1125,Nice,Pleasant and agreeable,"Mean, rude, unpleasant, unfriendly","Friendly, kind, amiable, affable",The student was always nice to his classmates.,2 class
1126,Nervous,Anxious and uneasy,"Calm, relaxed, composed, confident","Anxious, apprehensive, uneasy, worried",The student felt nervous before taking the test.,2 class
1127,Noble,Having high moral principles,"Dishonorable, unethical, immoral, base","Honorable, virtuous, ethical, righteous",The student's actions showed a noble character.,2 class
1128,Naughty,Behaving badly or disobediently,"Obedient, well-behaved, compliant, dutiful","Mischievous, disobedient, unruly, impish",The student was being naughty and not listening to the teacher.,2 class
1129,Natural,Not artificial or forced,"Artificial, fake, contrived, forced","Genuine, authentic, spontaneous, uncontrived",The student had a natural talent for art.,2 class
1130,Needy,Lacking basic necessities or support,"Wealthy, affluent, self-sufficient, independent","Poor, impoverished, destitute, underprivileged",The student's family was in a needy situation and needed help.,2 class
1131,Noble-minded,Having high moral principles and ideals,"Dishonorable, unethical, immoral, base","Honorable, virtuous, ethical, righteous",The student had a noble-minded approach to problem-solving.,2 class
1132,Nifty,Attractive and stylish,"Unfashionable, outdated, uncool, dull","Cool, chic, trendy, fashionable",The student's new backpack was nifty and stylish.,2 class
1133,Noisy,Making a lot of noise,"Quiet, peaceful, serene, tranquil","Loud, boisterous, clamorous, raucous",The student's behavior was noisy and disruptive during class.,2 class
1134,Normal,Typical and expected,"Abnormal, unusual, atypical, exceptional","Average, typical, standard, ordinary",The student's behavior was normal and within the expected range.,2 class
1135,Nostalgic,Feeling a longing for the past,"Unsentimental, unemotional, indifferent, aloof","Sentimental, wistful, yearning, longing",The student felt nostalgic when looking at old family photos.,2 class
1136,Nurturing,Providing care and support for others,"Neglectful, uncaring, indifferent, aloof","Caring, attentive, affectionate, protective",The teacher was very nurturing towards her students.,2 class
1137,Nervy,Bold and daring,"Timid, cowardly, fearful, afraid","Bold, daring, courageous, fearless",The student showed a nervy approach to solving the problem.,2 class
1138,Noteworthy,Worthy of attention or notice,"Insignificant, unremarkable, ordinary, average","Remarkable, notable, significant, outstanding",The student's achievements were noteworthy and impressive.,2 class
1139,Novel,New and original,"Unoriginal, derivative, clichd, hackneyed","Innovative, fresh, unique, creative",The student had a novel idea for a science project.,2 class
1140,Nippy,Chilly or cold,"Warm, hot, balmy, sultry","Cold, chilly, frosty, freezing",The student felt nippy in the winter weather.,2 class
1141,Thankful,Feeling or expressing gratitude,"Ungrateful, thankless, unappreciative, resentful","Grateful, appreciative, obliged, beholden",The student was thankful for the help from the teacher.,2 class
1142,Talkative,Fond of talking or conversing,"Quiet, reserved, uncommunicative, taciturn","Chatty, communicative, sociable, garrulous",The student was very talkative and enjoyed chatting with classmates.,2 class
1143,Timid,Shy or lacking confidence,"Bold, confident, brave, fearless","Shy, bashful, hesitant, apprehensive",The student was too timid to ask a question in class.,2 class
1144,Tidy,Clean and organized,"Messy, untidy, disorganized, sloppy","Neat, orderly, pristine, immaculate",The student's room was always tidy and clean.,2 class
1145,Thoughtful,Showing consideration for others,"Inconsiderate, thoughtless, uncaring, selfish","Considerate, kind, caring, empathetic",The student was very thoughtful and helped his friend in need.,2 class
1146,Trustworthy,Able to be relied on,"Unreliable, untrustworthy, dishonest, deceitful","Reliable, dependable, honest, faithful",The student was trustworthy and always kept his promises.,2 class
1147,Talented,Having a natural skill or ability,"Untalented, unskilled, incompetent, inept","Gifted, skilled, proficient, accomplished",The student was very talented in playing the piano.,2 class
1148,Tasty,Having a pleasing flavor,"Tasteless, bland, unappetizing, unpalatable","Delicious, savory, appetizing, flavorful",The student's homemade cookies were very tasty.,2 class
1149,Terrific,Very good or impressive,"Terrible, awful, dreadful, horrendous","Excellent, wonderful, fantastic, amazing",The student's performance in the school play was terrific.,2 class
1150,Tough,Difficult or challenging,"Easy, simple, effortless, undemanding","Challenging, demanding, arduous, strenuous",The student found the math problem very tough to solve.,2 class
1151,Temperate,Moderate or mild,"Extreme, harsh, severe, intense","Moderate, mild, temperate, gentle",The student enjoyed the temperate weather during the spring.,2 class
1152,Thrifty,Careful with money,"Wasteful, extravagant, lavish, spendthrift","Frugal, economical, thrifty, prudent",The student was very thrifty and saved his allowance.,2 class
1153,Tired,Feeling exhausted or sleepy,"Energetic, rested, refreshed, wide awake","Fatigued, exhausted, worn out, sleepy",The student felt tired after playing outside all day.,2 class
1154,Terrified,Feeling extreme fear or terror,"Brave, unafraid, courageous, bold","Fearful, scared, frightened, petrified",The student was terrified of the dark.,2 class
1155,Timely,Happening at the right time,"Late, delayed, tardy, overdue","Prompt, on time, punctual, timely",The student always handed in his assignments timely.,2 class
1156,Trusting,Willing to believe or trust others,"Suspicious, skeptical, distrustful, cynical","Trustful, trusting, credulous, gullible",The student was very trusting of his friends.,2 class
1157,Teamwork,Cooperative effort by a group of people,"Individualism, competition, solo effort, isolation","Collaboration, cooperation, partnership, teamwork",The student excelled in teamwork during group projects.,2 class
1158,Polite,Showing good manners and respect,"Impolite, rude, discourteous, uncivil","Courteous, well-mannered, gracious, civil",The student always used polite language when speaking to adults.,2 class
1159,Patient,Able to wait calmly without becoming annoyed,"Impatient, restless, agitated, irritable","Tolerant, composed, unflappable, serene",The student was patient while waiting in line.,2 class
1160,Playful,Fond of playing or joking,"Serious, somber, solemn, sedate","Lively, spirited, fun-loving, mischievous",The student was always playful and enjoyed making jokes.,2 class
1161,Positive,Having a favorable or optimistic attitude,"Pessimistic, negative, hopeless, doubtful","Optimistic, upbeat, hopeful, confident",The student had a positive outlook on the future.,2 class
1162,Perseverant,Persistent in achieving a goal,"Quitting, giving up, surrendering, quitting","Persistent, determined, tenacious, steadfast",The student was perseverant in finishing his homework.,2 class
1163,Prepared,Ready for something in advance,"Unprepared, disorganized, unready, unequipped","Ready, organized, equipped, primed",The student was prepared for the math test.,2 class
1164,Pleasant,Agreeable or enjoyable,"Unpleasant, disagreeable, irritating, unpleasant","Enjoyable, agreeable, pleasing, delightful",The student had a pleasant smile and attitude.,2 class
1165,Polished,Smooth and shiny,"Dull, rough, unpolished, tarnished","Smooth, shiny, glossy, lustrous",The student's shoes were polished and shiny.,2 class
1166,Proud,Feeling a sense of satisfaction and honor,"Ashamed, embarrassed, humiliated, dishonorable","Proud, dignified, honorable, majestic",The student was proud of his academic achievements.,2 class
1167,Productive,Able to produce or accomplish something,"Unproductive, ineffective, fruitless, unsuccessful","Efficient, fruitful, successful, effective",The student was very productive during the study session.,2 class
1168,Prompt,Being on time or punctual,"Late, tardy, delayed, overdue","Timely, punctual, on time, immediate",The student was always prompt in submitting assignments.,2 class
1169,Polished,Having good manners and etiquette,"Uncultured, unrefined, coarse, unsophisticated","Cultured, refined, polished, sophisticated",The student had polished manners and spoke eloquently.,2 class
1170,Practical,Useful and functional in real-life situations,"Impractical, idealistic, theoretical, unrealistic","Pragmatic, realistic, functional, utilitarian",The student had a practical approach to problem-solving.,2 class
1171,Punctual,Being on time or prompt,"Late, delayed, tardy, overdue","Timely, prompt, on time, punctual",The student was always punctual for class.,2 class
1172,Proud,Feeling a sense of self-esteem and self-respect,"Ashamed, embarrassed, insecure, unsure","Proud, confident, self-assured, self-respectful",The student was proud of who they were and what they had accomplished.,2 class
1173,Playmate,A person who plays or engages in activities with another person,"Enemy, rival, foe, adversary","Companion, friend, buddy, playmate",The student enjoyed spending time with his playmate.,2 class
1174,Persistent,Continuing or recurring over a long period of time,"Giving up, quitting, surrendering, submissive","Persevering, tenacious, stubborn, relentless",The student was persistent in mastering the new skill.,2 class
1175,Lion,A large carnivorous feline mammal,"Herbivore, Domestic Cat, Coward, Weakling","Panthera leo, King of the Jungle, Wild Cat, Big Cat",The lion is the king of the jungle.,2 class
1176,Lemon,A tart fruit with yellow skin and acidic juice,"Sweet, Mild, Bland, Flavorless","Citrus, Sour, Tangy, Acidic",The lemonade tastes sour because of the lemon juice.,2 class
1177,Llama,A domesticated South American mammal used for meat and wool,"Predator, Prey, Wild, Feral","Camelid, Andean Pack Animal, Alpaca, Vicua",The llama is carrying a heavy load on its back.,2 class
1178,Lizard,"A reptile with scaly skin, four legs, and a long tail","Mammal, Bird, Fish, Amphibian","Gecko, Chameleon, Skink, Iguana",The lizard basked in the sun on the rock.,2 class
1179,Laptop,A portable computer that can be used on one's lap,"Desktop, Workstation, Server, Mainframe","Notebook, Ultrabook, Chromebook, Tablet",The student uses a laptop to complete their school work.,2 class
1180,Lemonade,"A sweetened beverage made with lemon juice, water, and sugar","Unsweetened Drink, Bitter Drink, Unsavory Drink, Tart Drink","Citrus Drink, Lemon Juice, Lemon Water, Lemon Cooler",The student loves to drink lemonade on a hot day.,2 class
1181,Library,A place where books and other materials are kept for reading and research,"Bookstore, Newsstand, Magazine Rack, Gaming Store","Collection, Repository, Archive, Resource Center",The student visits the library to borrow books for their research.,2 class
1182,Lollipop,A piece of hard candy on a stick,"Vegetable, Fruit, Nut, Savory","Sucker, Candy Pop, Sweet Treat, Confection",The student received a lollipop as a reward for their good behavior.,2 class
1183,Lightning,A sudden and powerful electrical discharge in the atmosphere,"Calm, Serene, Peaceful, Quiet","Thunderbolt, Electric Spark, Arc, Flash",The student is afraid of lightning during thunderstorms.,2 class
1184,Letter,A written or printed message addressed to a person or organization,"Phone Call, Text Message, Email, Telegram","Note, Missive, Memo, Dispatch",The student wrote a letter to their pen pal in another country.,2 class
1185,Lunch,"A midday meal, typically eaten at school or work","Breakfast, Dinner, Supper, Late-Night Snack","Midday Meal, Noon Meal, Brunch, Snack",The student brought a sandwich and fruit for their lunch at school.,2 class
1186,Laugh,To make the sounds and movements that express amusement or joy,"Cry, Sob, Weep, Wail","Chuckle, Giggle, Snicker, Chortle",The student laughed at the funny joke told by their teacher.,2 class
1187,Luggage,"Suitcases, bags, and other containers used to carry one's belongings","Unpacked, Unloaded, Unpacked, Unburdened","Baggage, Trunk, Satchel, Backpack",The student packed their luggage for their trip to visit their grandparents.,2 class
1188,Lipstick,A cosmetic applied to the lips for color and texture,"Foundation, Concealer, Eye Shadow, Mascara","Lip Gloss, Lip Balm, Lip Stain, Lip Tint",The student's mother wears red lipstick to work every day.,2 class
1189,Optimistic,Having a positive outlook on life,"Pessimistic, negative, gloomy, doubtful","Positive, hopeful, confident, upbeat",The student was optimistic about their chances of success.,2 class
1190,Observant,Paying attention to details,"Inattentive, unobservant, unaware, oblivious","Attentive, perceptive, watchful, alert",The student was very observant and noticed even the smallest details.,2 class
1191,Organized,Arranged in a systematic way,"Disorganized, chaotic, messy, unstructured","Systematic, orderly, structured, methodical",The student's backpack was always organized and tidy.,2 class
1192,Outgoing,Friendly and sociable,"Shy, introverted, reserved, unsociable","Friendly, sociable, gregarious, extroverted",The student was outgoing and made friends easily.,2 class
1193,Obedient,Following rules and authority,"Disobedient, rebellious, defiant, insubordinate","Compliant, submissive, dutiful, respectful",The student was obedient and always followed the teacher's instructions.,2 class
1194,Open-minded,Willing to consider new ideas,"Closed-minded, intolerant, biased, narrow-minded","Receptive, accepting, unprejudiced, unbiased",The student was open-minded and willing to listen to different perspectives.,2 class
1195,Original,Creative and unique,"Unoriginal, conventional, ordinary, uncreative","Creative, innovative, unique, inventive",The student's artwork was original and imaginative.,2 class
1196,Optimism,A positive outlook on life,"Pessimism, negativity, hopelessness, doubt","Positivity, hope, confidence, positivity",The student's optimism was contagious and lifted the mood of the class.,2 class
1197,Outspoken,Expressing opinions and thoughts freely,"Reserved, quiet, shy, timid","Frank, candid, blunt, direct",The student was outspoken and always shared their thoughts and ideas.,2 class
1198,Outstanding,Exceptionally good or impressive,"Average, mediocre, ordinary, unremarkable","Excellent, exceptional, remarkable, extraordinary",The student's academic performance was outstanding.,2 class
1199,Observance,The act of watching or noticing something,"Neglect, inattention, disregard, obliviousness","Attention, vigilance, scrutiny, awareness",The student's observance of the rules was commendable.,2 class
1200,Ownership,Having control or possession of something,"Dispossession, loss, surrender, forfeiture","Possession, control, ownership, hold",The student took ownership of their mistakes and worked to improve.,2 class
1201,Observe,To watch or notice something,"Ignore, neglect, disregard, overlook","Watch, notice, see, perceive",The student was able to observe the changes in nature over time.,2 class
1202,Orderly,Arranged in a neat and organized way,"Messy, disorganized, chaotic, unstructured","Neat, tidy, systematic, structured",The student's desk was always orderly and clean.,2 class
1203,Overcome,To defeat or conquer something,"Surrender, give up, succumb, yield to","Conquer, defeat, master, triumph over",The student was able to overcome their fear of public speaking.,2 class
1204,Objective,Unbiased and based on facts,"Biased, prejudiced, subjective, opinionated","Impartial, fair, neutral, unbiased",The student's analysis of the data was objective and impartial.,2 class
1205,Cat,A small carnivorous mammal domesticated as a pet,"Dog, Fish, Bird, Reptile","Feline, Kitty, Tom, Puss",The student loves to play with their cat after school.,2 class
1206,Carrot,An orange root vegetable rich in vitamin A,"Meat, Sweet, Dessert, Junk Food","Root, Veggie, Orange Stick, Rabbit Food",The student's favorite snack is carrot sticks with ranch dressing.,2 class
1207,Clock,A device for measuring and displaying time,"Sundial, Hourglass, Calendar, Calendar","Timepiece, Watch, Stopwatch, Timer",The student uses the clock to know when it's time for class.,2 class
1208,Cloud,A visible mass of condensed water vapor in the sky,"Clear, Sunny, Bright, Blue Sky","Cumulus, Nimbus, Stratus, Cirrus",The student sees a rabbit in the shape of a cloud in the sky.,2 class
1209,Camera,A device used for taking photographs or making videos,"Projector, Screen, Film, Darkroom","Cam, Camcorder, Video Camera, Digital Camera",The student took a picture of their family with their camera.,2 class
1210,Cookie,A small sweet baked treat usually eaten as a dessert,"Vegetable, Fruit, Meat, Soup","Biscuit, Cracker, Waffle, Brownie",The student loves to eat chocolate chip cookies after dinner.,2 class
1211,Cupcake,A small cake baked in a cup-shaped container,"Vegetable, Fruit, Meat, Soup","Muffin, Fairy Cake, Patty Cake, Sweet Treat",The student's mother made them vanilla cupcakes for their birthday.,2 class
1212,Chair,A seat with a back and typically four legs for one person,"Table, Bed, Couch, Futon","Seat, Stool, Bench, Ottoman",The student sits on a chair at their desk to do their homework.,2 class
1213,Crayon,A stick of colored wax used for drawing or coloring,"Eraser, Sharpener, Pen, Pencil","Coloring Pencil, Marker, Chalk, Paint",The student colored a picture with their blue crayon.,2 class
1214,Circle,A round shape with no beginning or end,"Square, Triangle, Rectangle, Hexagon","Ring, Round, Sphere, Disc",The student drew a circle on their paper using their compass.,2 class
1215,Candy,"A sweet food made with sugar or syrup, often flavored and colored","Vegetable, Fruit, Meat, Soup","Sweet Treat, Lollipop, Chocolate, Gumdrop",The student's teacher gave them candy for doing well on their test.,2 class
1216,Cracker,"A thin, crisp biscuit usually eaten with cheese or spreads","Vegetable, Fruit, Meat, Soup","Biscuit, Cookie, Saltine, Wheat Thin",The student ate crackers and cheese for their snack.,2 class
1217,Clap,To strike the palms of one's hands together as a form of applause or to make a loud sound,"Whisper, Mumble, Shush, Hush","Applaud, Cheer, Clatter, Slam",The student clapped their hands when their friend finished singing.,2 class
1218,Cactus,A desert plant with spines instead of leaves,"Flower, Tree, Grass, Shrub","Prickly Pear, Succulent, Agave, Aloe Vera",The student saw a cactus in the desert during their vacation.,2 class
1219,Jacket,"A piece of clothing worn on the upper body, typically having sleeves and a fastening down the front","Shirt, Tank Top, Dress, Shorts","Coat, Blazer, Parka, Windbreaker",The student wears a jacket to keep warm on cold days.,2 class
